stock,date,date_only,headline,headline_raw
BAC,2026-03-13 11:03:22,2026-03-13,"Even if oil moves back to $60, this oil stock stand out: __COMPANY__","Even if oil moves back to $60, this oil stock stand out: BofA"
WFC,2026-03-13 11:16:25,2026-03-13,__COMPANY__ More Confident on Carnival (CCL) Amid Strong Cruise Demand and Booking Patterns,Wells Fargo More Confident on Carnival (CCL) Amid Strong Cruise Demand and Booking Patterns
BAC,2026-03-13 11:16:28,2026-03-13,"__COMPANY__ Bullish on General Motors (GM), Describes It As Leading Automaker","BofA Bullish on General Motors (GM), Describes It As Leading Automaker"
ING,2026-03-13 11:46:26,2026-03-13,"Stocks Rise Pre-Bell as Traders Await Key Inflation Report, Monitor Oil Prices Amid Middle East War","Stocks Rise Pre-Bell as Traders Await Key Inflation Report, Monitor Oil Prices Amid Middle East War"
MS,2026-03-13 11:53:06,2026-03-13,__COMPANY__ ’s North Haven BDC sticks to 5% cap as redemption requests reach 10.9%,Morgan Stanley’s North Haven BDC sticks to 5% cap as redemption requests reach 10.9%
BAC,2026-03-13 11:58:31,2026-03-13,__COMPANY__ ’s Hartnett Warns Markets Are Starting to Look Like 2008,BofA’s Hartnett Warns Markets Are Starting to Look Like 2008
C,2026-03-13 12:12:02,2026-03-13,__COMPANY__ Dubai Evacuation Puts Operational Risks And Valuation In Focus,Citigroup Dubai Evacuation Puts Operational Risks And Valuation In Focus
GS,2026-03-13 12:31:39,2026-03-13,3 Big Reasons __TICKER__ Should Be On Your Watchlist,3 Big Reasons GS Should Be On Your Watchlist
GS,2026-03-13 12:39:00,2026-03-13,What Is the Jones Act and Why It Matters for Soaring Oil Prices,What Is the Jones Act and Why It Matters for Soaring Oil Prices
GS,2026-03-13 13:01:07,2026-03-13,Analysis: The U.S. is running out of ways to get oil prices down. It is up to the military.,Analysis: The U.S. is running out of ways to get oil prices down. It is up to the military.
C,2026-03-13 13:02:00,2026-03-13,"CNBC Halftime Report Final Trades: Meta Platforms, NVIDIA, __COMPANY__ , __COMPANY__ Nasdaq-100 Premium Income ETF","CNBC Halftime Report Final Trades: Meta Platforms, NVIDIA, Citigroup, Goldman Sachs Nasdaq-100 Premium Income ETF"
WFC,2026-03-13 13:05:00,2026-03-13,"Wall Street Roundup: War, Oil, Airlines, Energy, AI, Private Credit","Wall Street Roundup: War, Oil, Airlines, Energy, AI, Private Credit"
GS,2026-03-13 13:05:00,2026-03-13,"Wall Street Roundup: War, Oil, Airlines, Energy, AI, Private Credit","Wall Street Roundup: War, Oil, Airlines, Energy, AI, Private Credit"
C,2026-03-13 13:11:44,2026-03-13,"Final Trades: __COMPANY__ , Nvidia, Meta and the GPIQ","Final Trades: Citigroup, Nvidia, Meta and the GPIQ"
GS,2026-03-13 13:14:00,2026-03-13,Oil Prices Fall Below $100. India Asks Iran to Allow 23 Tankers Through Strait of Hormuz.,Oil Prices Fall Below $100. India Asks Iran to Allow 23 Tankers Through Strait of Hormuz.
GS,2026-03-13 13:16:15,2026-03-13,'SpaceX Discusses Dividing Up Bank Roles In Echo Of Alibaba's Lineup; Discusses Dividing IPO Roles Among Many Investment Banks; SpaceX Considered Having __COMPANY__ And __COMPANY__ Focusing On Allocating Shares To Institutional Investors; Considered __COMPANY__ And __COMPANY__ Oversee Selling Shares To Individual Investors' - The Information,'SpaceX Discusses Dividing Up Bank Roles In Echo Of Alibaba's Lineup; Discusses Dividing IPO Roles Among Many Investment Banks; SpaceX Considered Having Morgan Stanley And Goldman Sachs Focusing On Allocating Shares To Institutional Investors; Considered Bank Of America And Citi Oversee Selling Shares To Individual Investors' - The Information
MS,2026-03-13 13:16:15,2026-03-13,'SpaceX Discusses Dividing Up Bank Roles In Echo Of Alibaba's Lineup; Discusses Dividing IPO Roles Among Many Investment Banks; SpaceX Considered Having __COMPANY__ And __COMPANY__ Focusing On Allocating Shares To Institutional Investors; Considered __COMPANY__ And __COMPANY__ Oversee Selling Shares To Individual Investors' - The Information,'SpaceX Discusses Dividing Up Bank Roles In Echo Of Alibaba's Lineup; Discusses Dividing IPO Roles Among Many Investment Banks; SpaceX Considered Having Morgan Stanley And Goldman Sachs Focusing On Allocating Shares To Institutional Investors; Considered Bank Of America And Citi Oversee Selling Shares To Individual Investors' - The Information
C,2026-03-13 13:16:15,2026-03-13,'SpaceX Discusses Dividing Up Bank Roles In Echo Of Alibaba's Lineup; Discusses Dividing IPO Roles Among Many Investment Banks; SpaceX Considered Having __COMPANY__ And __COMPANY__ Focusing On Allocating Shares To Institutional Investors; Considered __COMPANY__ And __COMPANY__ Oversee Selling Shares To Individual Investors' - The Information,'SpaceX Discusses Dividing Up Bank Roles In Echo Of Alibaba's Lineup; Discusses Dividing IPO Roles Among Many Investment Banks; SpaceX Considered Having Morgan Stanley And Goldman Sachs Focusing On Allocating Shares To Institutional Investors; Considered Bank Of America And Citi Oversee Selling Shares To Individual Investors' - The Information
BAC,2026-03-13 13:16:15,2026-03-13,'SpaceX Discusses Dividing Up Bank Roles In Echo Of Alibaba's Lineup; Discusses Dividing IPO Roles Among Many Investment Banks; SpaceX Considered Having __COMPANY__ And __COMPANY__ Focusing On Allocating Shares To Institutional Investors; Considered __COMPANY__ And __COMPANY__ Oversee Selling Shares To Individual Investors' - The Information,'SpaceX Discusses Dividing Up Bank Roles In Echo Of Alibaba's Lineup; Discusses Dividing IPO Roles Among Many Investment Banks; SpaceX Considered Having Morgan Stanley And Goldman Sachs Focusing On Allocating Shares To Institutional Investors; Considered Bank Of America And Citi Oversee Selling Shares To Individual Investors' - The Information
GS,2026-03-13 13:35:01,2026-03-13,"Down 12.9% in 4 Weeks, Here's Why Goldman __TICKER__ Looks Ripe for a Turnaround","Down 12.9% in 4 Weeks, Here's Why Goldman (GS) Looks Ripe for a Turnaround"
WFC,2026-03-13 13:35:14,2026-03-13,9 Financials Stocks With Whale Alerts In Today's Session,9 Financials Stocks With Whale Alerts In Today's Session
MS,2026-03-13 13:35:14,2026-03-13,9 Financials Stocks With Whale Alerts In Today's Session,9 Financials Stocks With Whale Alerts In Today's Session
BAC,2026-03-13 14:03:46,2026-03-13,"More people will own a humanoid robot than a car by 2060, __COMPANY__ predicts","More people will own a humanoid robot than a car by 2060, BofA predicts"
BAC,2026-03-13 14:11:34,2026-03-13,Assessing Ligand Pharmaceuticals (LGND) Valuation After __COMPANY__ ’s New Buy Rating,Assessing Ligand Pharmaceuticals (LGND) Valuation After Bank Of America’s New Buy Rating
DB,2026-03-13 14:52:19,2026-03-13,__COMPANY__ : Recent Pullback Provides A Buying Opportunity,Deutsche Bank: Recent Pullback Provides A Buying Opportunity
MS,2026-03-13 14:57:51,2026-03-13,DOJ to appeal judge's decision to block Fed subpoenas in Powell criminal probe,DOJ to appeal judge's decision to block Fed subpoenas in Powell criminal probe
BAC,2026-03-13 14:57:51,2026-03-13,DOJ to appeal judge's decision to block Fed subpoenas in Powell criminal probe,DOJ to appeal judge's decision to block Fed subpoenas in Powell criminal probe
C,2026-03-13 14:57:51,2026-03-13,DOJ to appeal judge's decision to block Fed subpoenas in Powell criminal probe,DOJ to appeal judge's decision to block Fed subpoenas in Powell criminal probe
GS,2026-03-13 14:57:51,2026-03-13,DOJ to appeal judge's decision to block Fed subpoenas in Powell criminal probe,DOJ to appeal judge's decision to block Fed subpoenas in Powell criminal probe
WFC,2026-03-13 14:57:51,2026-03-13,DOJ to appeal judge's decision to block Fed subpoenas in Powell criminal probe,DOJ to appeal judge's decision to block Fed subpoenas in Powell criminal probe
BAC,2026-03-13 15:00:00,2026-03-13,Barron’s 100 Most Influential Women in U.S. Finance,Barron’s 100 Most Influential Women in U.S. Finance
C,2026-03-13 15:00:00,2026-03-13,Barron’s 100 Most Influential Women in U.S. Finance,Barron’s 100 Most Influential Women in U.S. Finance
BAC,2026-03-13 15:00:52,2026-03-13,Nvidia's GTC will mark an AI chip pivot. Here's why the CPU is taking center stage,Nvidia's GTC will mark an AI chip pivot. Here's why the CPU is taking center stage
RY,2026-03-13 15:27:00,2026-03-13,"Canadian Banks On Solid Ground, But Uncertainty Hangs Over Outlook","Canadian Banks On Solid Ground, But Uncertainty Hangs Over Outlook"
MS,2026-03-13 15:38:00,2026-03-13,"This pocket of software is likely to outperform going forward, __COMPANY__ says","This pocket of software is likely to outperform going forward, Morgan Stanley says"
GS,2026-03-13 15:40:02,2026-03-13,__TICKER__ or MKTX: Which Is the Better Value Stock Right Now?,GS or MKTX: Which Is the Better Value Stock Right Now?
GS,2026-03-13 15:52:46,2026-03-13,__COMPANY__ Remains Bullish on Petco (WOOF) With $3.95 Price Target,Goldman Sachs Remains Bullish on Petco (WOOF) With $3.95 Price Target
ING,2026-03-13 16:11:46,2026-03-13,European Equities Traded in the US as American Depositary Receipts Decline in Friday Trading,European Equities Traded in the US as American Depositary Receipts Decline in Friday Trading
TD,2026-03-13 16:24:23,2026-03-13,"TSX Down 188 Points at Midday With Miners, Info Tech, The Worst Performers","TSX Down 188 Points at Midday With Miners, Info Tech, The Worst Performers"
GS,2026-03-13 16:46:00,2026-03-13,Oil Prices Hover Near $100. India Asks Iran to Allow 23 Tankers Through Strait of Hormuz.,Oil Prices Hover Near $100. India Asks Iran to Allow 23 Tankers Through Strait of Hormuz.
STT,2026-03-13 16:54:00,2026-03-13,__COMPANY__ Corp. stock underperforms Friday when compared to competitors,State Street Corp. stock underperforms Friday when compared to competitors
C,2026-03-13 16:59:00,2026-03-13,"David Bailin: Armed With AI, an Ex- __COMPANY__ CIO Strives to Shake Up the Industry","David Bailin: Armed With AI, an Ex-Citi CIO Strives to Shake Up the Industry"
GS,2026-03-13 17:07:08,2026-03-13,__COMPANY__ forecasts oil at $100 a barrel for March,Goldman Sachs forecasts oil at $100 a barrel for March
BAC,2026-03-13 17:11:54,2026-03-13,How Coca-Cola (KO) Narrative Is Shifting As Analysts Rework Targets And Bottler Focus,How Coca-Cola (KO) Narrative Is Shifting As Analysts Rework Targets And Bottler Focus
RY,2026-03-13 17:57:46,2026-03-13,__COMPANY__ Stands Out During Recent Dip In Bank Stocks,Royal Bank Of Canada Stands Out During Recent Dip In Bank Stocks
MS,2026-03-13 18:05:45,2026-03-13,Billionaire Investor Stanley Druckenmiller Bullish on Stablecoin Growth,Billionaire Investor Stanley Druckenmiller Bullish on Stablecoin Growth
BAC,2026-03-13 18:09:08,2026-03-13,This Is Elon Musk's Latest Optimus 3 Production Timeline,This Is Elon Musk's Latest Optimus 3 Production Timeline
C,2026-03-13 18:12:26,2026-03-13,Why The Centrica ( __TICKER__ ) Narrative Is Shifting As Analysts Reassess Upside And Risks,Why The Centrica (LSE:CNA) Narrative Is Shifting As Analysts Reassess Upside And Risks
GS,2026-03-13 18:30:00,2026-03-13,Bargain Alert: __COMPANY__ and __COMPANY__ Look Deeply Oversold,Bargain Alert: Wells Fargo and Goldman Sachs Look Deeply Oversold
WFC,2026-03-13 18:30:00,2026-03-13,Bargain Alert: __COMPANY__ and __COMPANY__ Look Deeply Oversold,Bargain Alert: Wells Fargo and Goldman Sachs Look Deeply Oversold
GS,2026-03-13 18:58:45,2026-03-13,Why PAR Technology (PAR) Stock Is Down Today,Why PAR Technology (PAR) Stock Is Down Today
MS,2026-03-13 19:00:29,2026-03-13,Wall Street Icon Warns: Waiting for Perfect Info Will Keep You on the Sidelines — How Top Traders Get In Early,Wall Street Icon Warns: Waiting for Perfect Info Will Keep You on the Sidelines — How Top Traders Get In Early
BAC,2026-03-13 19:05:03,2026-03-13,Explore the S&P500 index on Friday and find out which stocks are the most active in today's session.,Explore the S&P500 index on Friday and find out which stocks are the most active in today's session.
WFC,2026-03-13 19:11:23,2026-03-13,How The Himadri Speciality Chemical (BSE:500184) Narrative Is Evolving With An Unchanged ₹470 Target,How The Himadri Speciality Chemical (BSE:500184) Narrative Is Evolving With An Unchanged ₹470 Target
MS,2026-03-13 21:01:13,2026-03-13,"Stan Druckenmiller Says 'We Don't Know How This Movie Is Going to Play Out' on AI, Jobs and Inflation — Here's How Workers Can Prepare for What's Next","Stan Druckenmiller Says 'We Don't Know How This Movie Is Going to Play Out' on AI, Jobs and Inflation — Here's How Workers Can Prepare for What's Next"
GS,2026-03-13 21:28:00,2026-03-13,What Is the Jones Act and How Would Waiving It Help Lower Oil Prices?,What Is the Jones Act and How Would Waiving It Help Lower Oil Prices?
BAC,2026-03-13 22:30:20,2026-03-13,"__COMPANY__ Says ""A Lot of Art Changing Hands"" — Why High‐Net‐Worth Investors Are Paying Attention","Bank of America Says ""A Lot of Art Changing Hands"" — Why High‑Net‑Worth Investors Are Paying Attention"
BAC,2026-03-14 01:12:13,2026-03-14,How The S&P Global (SPGI) Story Is Shifting As Analysts Recalibrate AI And Valuation Risks,How The S&P Global (SPGI) Story Is Shifting As Analysts Recalibrate AI And Valuation Risks
MS,2026-03-14 01:12:13,2026-03-14,How The S&P Global (SPGI) Story Is Shifting As Analysts Recalibrate AI And Valuation Risks,How The S&P Global (SPGI) Story Is Shifting As Analysts Recalibrate AI And Valuation Risks
WFC,2026-03-14 02:42:51,2026-03-14,"__COMPANY__ Starts Coverage of Hasbro (HAS), Sees Balanced Risk and Reward","Wells Fargo Starts Coverage of Hasbro (HAS), Sees Balanced Risk and Reward"
GS,2026-03-14 04:24:29,2026-03-14,Does __COMPANY__ __TICKER__ Offer Value After Recent Share Price Pullback?,Does Goldman Sachs (GS) Offer Value After Recent Share Price Pullback?
GS,2026-03-14 08:15:22,2026-03-14,Geopolitical risk shocks S&P 500 as Goldman warns of oil-driven GDP drag,Geopolitical risk shocks S&P 500 as Goldman warns of oil-driven GDP drag
WFC,2026-03-14 09:15:00,2026-03-14,Hedge Your Portfolio With These Two 11%+ Yield Covered Call ETFs,Hedge Your Portfolio With These Two 11%+ Yield Covered Call ETFs
GS,2026-03-14 10:13:54,2026-03-14,Goldman: Software giants face ‘radical transformation’ as agentic AI rises,Goldman: Software giants face ‘radical transformation’ as agentic AI rises
MS,2026-03-14 11:02:34,2026-03-14,‘Get Your Shopping Lists Ready’: __COMPANY__ Suggests 2 Stocks to Buy as Market Weakness Could Create Opportunity,‘Get Your Shopping Lists Ready’: Morgan Stanley Suggests 2 Stocks to Buy as Market Weakness Could Create Opportunity
MS,2026-03-14 12:00:00,2026-03-14,Here are the ways private-credit pain could hurt your portfolio,Here are the ways private-credit pain could hurt your portfolio
WFC,2026-03-14 12:00:00,2026-03-14,Here are the ways private-credit pain could hurt your portfolio,Here are the ways private-credit pain could hurt your portfolio
C,2026-03-14 13:40:42,2026-03-14,Kohl’s price target lowered to $14 from $20 at __COMPANY__,Kohl’s price target lowered to $14 from $20 at Citi
MS,2026-03-14 13:56:06,2026-03-14,__COMPANY__ says Fed risks are skewed towards later and more cuts,Morgan Stanley says Fed risks are skewed towards later and more cuts
MS,2026-03-14 14:00:44,2026-03-14,__COMPANY__ ‘most constructive’ on Match Group shares in years,Morgan Stanley ‘most constructive’ on Match Group shares in years
BAC,2026-03-14 14:41:41,2026-03-14,Jim Cramer Says He Would “Stick With __COMPANY__ ”,Jim Cramer Says He Would “Stick With Bank of America”
BK,2026-03-14 15:08:05,2026-03-14,The Bull Case For __COMPANY__ __TICKER__ Could Change Following Supportive Wall Street Commentary On Its Rate-Sensitive Model,The Bull Case For Bank of New York Mellon (BK) Could Change Following Supportive Wall Street Commentary On Its Rate-Sensitive Model
BAC,2026-03-14 15:09:56,2026-03-14,How The Greenbrier Companies (GBX) Story Is Shifting On Earnings Quality And Valuation Hopes,How The Greenbrier Companies (GBX) Story Is Shifting On Earnings Quality And Valuation Hopes
GS,2026-03-14 15:20:00,2026-03-14,"__COMPANY__ Sees a ""Flight to Quality"" in Artificial Intelligence (AI). This Stock Fits the Bill for 2026.","Goldman Sachs Sees a ""Flight to Quality"" in Artificial Intelligence (AI). This Stock Fits the Bill for 2026."
BAC,2026-03-14 16:55:28,2026-03-14,"__COMPANY__ lifts memory chip forecasts, expects no supply cuts from Iran conflict","BofA lifts memory chip forecasts, expects no supply cuts from Iran conflict"
GS,2026-03-14 17:31:16,2026-03-14,"__COMPANY__ Executive Says Some Clients Are 'Glad' Iran War Shifted Focus Away From Software Exposure, Private Credit Woes: Report","Goldman Sachs Executive Says Some Clients Are 'Glad' Iran War Shifted Focus Away From Software Exposure, Private Credit Woes: Report"
GS,2026-03-14 17:46:32,2026-03-14,"Best CD rates today, March 14, 2026 (best account provides 4% APY)","Best CD rates today, March 14, 2026 (best account provides 4% APY)"
BAC,2026-03-14 18:03:00,2026-03-14,__COMPANY__ has a stark warning for stock investors,Bank of America has a stark warning for stock investors
C,2026-03-14 19:25:05,2026-03-14,__COMPANY__ : Bank Isn’t Leaving Middle East and Reports About Strikes Are False,Citi: Bank Isn’t Leaving Middle East and Reports About Strikes Are False
WFC,2026-03-14 20:09:29,2026-03-14,How The Autodesk (ADSK) Investment Story Is Evolving As Growth Assumptions And Valuations Reset,How The Autodesk (ADSK) Investment Story Is Evolving As Growth Assumptions And Valuations Reset
BAC,2026-03-14 20:36:16,2026-03-14,"__COMPANY__ Lowers PT on NU Holdings (NU), Keeps a Hold Rating","BofA Lowers PT on NU Holdings (NU), Keeps a Hold Rating"
WFC,2026-03-14 21:13:06,2026-03-14,A Look At Air Products And Chemicals (APD) Valuation After __COMPANY__ ’s Overweight Upgrade And Hydrogen Contract Wins,A Look At Air Products And Chemicals (APD) Valuation After Wells Fargo’s Overweight Upgrade And Hydrogen Contract Wins
C,2026-03-14 22:10:21,2026-03-14,How The Western Alliance (WAL) Investment Narrative Is Shifting After Recent Credit Headlines,How The Western Alliance (WAL) Investment Narrative Is Shifting After Recent Credit Headlines
GS,2026-03-14 23:54:15,2026-03-14,$15 billion exit: Asian equities tumble as Goldman warns of prolonged oil shock,$15 billion exit: Asian equities tumble as Goldman warns of prolonged oil shock
C,2026-03-15 00:16:49,2026-03-15,How The Ardagh Metal Packaging (AMBP) Narrative Is Shifting As Analyst Targets Diverge,How The Ardagh Metal Packaging (AMBP) Narrative Is Shifting As Analyst Targets Diverge
GS,2026-03-15 00:35:03,2026-03-15,Goldman: AI PCs to buck 10% market slump as ‘edge computing’ demand accelerates,Goldman: AI PCs to buck 10% market slump as ‘edge computing’ demand accelerates
GS,2026-03-15 01:37:00,2026-03-15,__COMPANY__ revamps Brent crude forecast for the rest of 2026,Goldman Sachs revamps Brent crude forecast for the rest of 2026
BK,2026-03-15 03:47:04,2026-03-15,"Anthony Scaramucci Says Bank Of New York CEO Sees AI Agents As Employees, Not Just Tools","Anthony Scaramucci Says Bank Of New York CEO Sees AI Agents As Employees, Not Just Tools"
MS,2026-03-15 06:00:36,2026-03-15,"Oil CEOs Warn of Supply Shock, __COMPANY__ & BlackRock Limit Withdrawals And More: This Week In Economy","Oil CEOs Warn of Supply Shock, Morgan Stanley & BlackRock Limit Withdrawals And More: This Week In Economy"
GS,2026-03-15 06:00:36,2026-03-15,"Oil CEOs Warn of Supply Shock, __COMPANY__ & BlackRock Limit Withdrawals And More: This Week In Economy","Oil CEOs Warn of Supply Shock, Morgan Stanley & BlackRock Limit Withdrawals And More: This Week In Economy"
BAC,2026-03-15 09:45:00,2026-03-15,"Warren Buffett returned 6,000,000% plus for investors over 60 years. Here are his 5 biggest wins and what to learn","Warren Buffett returned 6,000,000% plus for investors over 60 years. Here are his 5 biggest wins and what to learn"
WFC,2026-03-15 11:58:54,2026-03-15,What Would It Take to Tip the Economy into Recession?,What Would It Take to Tip the Economy into Recession?
BAC,2026-03-15 12:06:47,2026-03-15,Is There Now An Opportunity In __COMPANY__ __TICKER__ After Recent Share Price Weakness,Is There Now An Opportunity In Bank Of America (BAC) After Recent Share Price Weakness
C,2026-03-15 13:17:00,2026-03-15,U.S. Shipbuilding Revival: 3 Stocks to Watch Now,U.S. Shipbuilding Revival: 3 Stocks to Watch Now
GS,2026-03-15 15:17:46,2026-03-15,Why the United Arab Emirates is a target for Iran's aggression,Why the United Arab Emirates is a target for Iran's aggression
C,2026-03-15 15:17:46,2026-03-15,Why the United Arab Emirates is a target for Iran's aggression,Why the United Arab Emirates is a target for Iran's aggression
GS,2026-03-15 17:07:48,2026-03-15,__COMPANY__ Recasts Model With XRP ETFs And Private Capital Focus,Goldman Sachs Recasts Model With XRP ETFs And Private Capital Focus
MS,2026-03-15 17:31:16,2026-03-15,Exclusive: __COMPANY__ And BlackRock Limit Withdrawals—Is Private Credit Gating A Crisis Or Market 'Stabilizer'?,Exclusive: Morgan Stanley And BlackRock Limit Withdrawals—Is Private Credit Gating A Crisis Or Market 'Stabilizer'?
STT,2026-03-15 17:55:12,2026-03-15,__COMPANY__ Corporation __TICKER__ Says Q1 Results Are Expected to Come in Stronger Than Previously Anticipated,State Street Corporation (STT) Says Q1 Results Are Expected to Come in Stronger Than Previously Anticipated
GS,2026-03-15 17:56:15,2026-03-15,"__TICKER__ Lowers its Price Target on Lazard, Inc. (LAZ) to $48 from $59 and Maintains a Neutral Rating","UBS Lowers its Price Target on Lazard, Inc. (LAZ) to $48 from $59 and Maintains a Neutral Rating"
GS,2026-03-15 17:57:09,2026-03-15,"__COMPANY__ Raises its Price Target on The __COMPANY__ Group, Inc. __TICKER__ to $826 from $815 and Maintains a Neutral Rating","JPMorgan Raises its Price Target on The Goldman Sachs Group, Inc. (GS) to $826 from $815 and Maintains a Neutral Rating"
BAC,2026-03-15 17:57:41,2026-03-15,__COMPANY__ Corporation __TICKER__ Says Q1 Net Interest Income Is Tracking at Least 7% Higher Year Over Year,Bank of America Corporation (BAC) Says Q1 Net Interest Income Is Tracking at Least 7% Higher Year Over Year
C,2026-03-15 18:25:29,2026-03-15,__COMPANY__ Lifts PT on Johnson & Johnson (JNJ) to $274 From $250 – Here’s Why,Citi Lifts PT on Johnson & Johnson (JNJ) to $274 From $250 – Here’s Why
MS,2026-03-15 18:25:37,2026-03-15,__COMPANY__ Cuts PT on Wyndham Hotels & Resorts (WH) to $85 From $89 – Here’s Why,Morgan Stanley Cuts PT on Wyndham Hotels & Resorts (WH) to $85 From $89 – Here’s Why
BAC,2026-03-15 18:49:20,2026-03-15,__COMPANY__ Adjusts PT on BP p.l.c. (BP) to 400 GBp From 370 GBp – Here’s Why,BofA Adjusts PT on BP p.l.c. (BP) to 400 GBp From 370 GBp – Here’s Why
BAC,2026-03-15 18:49:24,2026-03-15,"__COMPANY__ Lifts PT on Shell plc (SHEL) to 3,250 GBp From 2,900 GBp – Here’s Why","BofA Lifts PT on Shell plc (SHEL) to 3,250 GBp From 2,900 GBp – Here’s Why"
BAC,2026-03-15 18:49:27,2026-03-15,__COMPANY__ Lifts PT on TotalEnergies SE (TTE) to EUR 75 From EUR 70 – Here’s Why,BofA Lifts PT on TotalEnergies SE (TTE) to EUR 75 From EUR 70 – Here’s Why
BAC,2026-03-15 18:49:31,2026-03-15,__COMPANY__ Lifts PT on Eni S.p.A. (E) to EUR 21 From EUR 18.50 – Here’s Why,BofA Lifts PT on Eni S.p.A. (E) to EUR 21 From EUR 18.50 – Here’s Why
GS,2026-03-15 19:57:51,2026-03-15,Asia-Pacific markets mixed as oil prices stay elevated amid escalating U.S.-Iran tensions,Asia-Pacific markets mixed as oil prices stay elevated amid escalating U.S.-Iran tensions
BAC,2026-03-15 21:07:53,2026-03-15,__COMPANY__ Uses Zelle To Speed Charitable Giving And Deepen Ties,Bank Of America Uses Zelle To Speed Charitable Giving And Deepen Ties
GS,2026-03-15 22:07:00,2026-03-15,"Holiday spending, export demand drive China’s economic momentum as Iran war headwinds loom","Holiday spending, export demand drive China’s economic momentum as Iran war headwinds loom"
GS,2026-03-15 23:09:53,2026-03-15,Trump’s warning over Kharg Island raises the stakes for Iran’s oil exports,Trump’s warning over Kharg Island raises the stakes for Iran’s oil exports
WFC,2026-03-15 23:13:45,2026-03-15,How The Check Point (CHKP) Investment Story Is Shifting As Growth Priorities Meet Firewall Caution,How The Check Point (CHKP) Investment Story Is Shifting As Growth Priorities Meet Firewall Caution
MS,2026-03-16 01:28:01,2026-03-16,Blue Owl Capital Corporation: Private Credit Risks Keep Rising,Blue Owl Capital Corporation: Private Credit Risks Keep Rising
GS,2026-03-16 02:51:23,2026-03-16,CNBC Daily Open: Strait talk from Trump,CNBC Daily Open: Strait talk from Trump
GS,2026-03-16 04:01:00,2026-03-16,__COMPANY__ Leverages Unique Ability to React Proactively to Private Credit Woes,JPMorgan Leverages Unique Ability to React Proactively to Private Credit Woes
GS,2026-03-16 04:01:00,2026-03-16,Clean Energy Regains Its Swagger as Hedge Against Wartime Oil Crisis,Clean Energy Regains Its Swagger as Hedge Against Wartime Oil Crisis
STT,2026-03-16 04:01:00,2026-03-16,__COMPANY__ Gives Asset-Backed Securities the Private Treatment,State Street Gives Asset-Backed Securities the Private Treatment
MS,2026-03-16 04:01:00,2026-03-16,Clean Energy Regains Its Swagger as Hedge Against Wartime Oil Crisis,Clean Energy Regains Its Swagger as Hedge Against Wartime Oil Crisis
BAC,2026-03-16 04:18:17,2026-03-16,Jim Cramer Warns Selling Now Is 'Huge Mistake' Despite $104 Brent Amid Iran War: Don't Let '$200 Oil' Naysayers Scare You Out,Jim Cramer Warns Selling Now Is 'Huge Mistake' Despite $104 Brent Amid Iran War: Don't Let '$200 Oil' Naysayers Scare You Out
MS,2026-03-16 06:06:56,2026-03-16,Street Calls of the Week,Street Calls of the Week
GS,2026-03-16 07:00:01,2026-03-16,4 financial resources to tap when you think layoffs may be coming,4 financial resources to tap when you think layoffs may be coming
