stock,date,date_only,headline,headline_raw
ING,2024-09-17 15:00:55,2024-09-17,What are share buybacks?,What are share buybacks?
SMFG,2025-04-02 03:26:24,2025-04-02,"PBOC Seen Deploying Stimulus Soon on Tariff Risks, Cash Shortage","PBOC Seen Deploying Stimulus Soon on Tariff Risks, Cash Shortage"
BACHY,2025-04-02 03:26:24,2025-04-02,"PBOC Seen Deploying Stimulus Soon on Tariff Risks, Cash Shortage","PBOC Seen Deploying Stimulus Soon on Tariff Risks, Cash Shortage"
BACHY,2025-04-02 07:33:46,2025-04-02,"Across Chinese Fintech And Bank Stocks, See Where FinVolution Stands Out","Across Chinese Fintech And Bank Stocks, See Where FinVolution Stands Out"
SMFG,2025-04-02 12:41:01,2025-04-02,Japan's __COMPANY__ Plans Stablecoin Development With Ava Labs Collaboration,Japan's SMBC Plans Stablecoin Development With Ava Labs Collaboration
SMFG,2025-04-02 13:34:13,2025-04-02,"Japanese Banking Giant __COMPANY__ Explores Stablecoin Use With Ava Labs, Fireblocks","Japanese Banking Giant SMBC Explores Stablecoin Use With Ava Labs, Fireblocks"
MFG,2025-04-03 11:40:29,2025-04-03,Shares of banking companies are trading lower as markets react to President Trump's announcement of sweeping tariffs.,Shares of banking companies are trading lower as markets react to President Trump's announcement of sweeping tariffs.
SMFG,2025-04-03 11:40:29,2025-04-03,Shares of banking companies are trading lower as markets react to President Trump's announcement of sweeping tariffs.,Shares of banking companies are trading lower as markets react to President Trump's announcement of sweeping tariffs.
MFG,2025-04-04 05:30:00,2025-04-04,Japan Megabank Stocks Plunge As Trump Tariffs Risk Monetary Policy Normalization,Japan Megabank Stocks Plunge As Trump Tariffs Risk Monetary Policy Normalization
SMFG,2025-04-04 05:30:00,2025-04-04,Japan Megabank Stocks Plunge As Trump Tariffs Risk Monetary Policy Normalization,Japan Megabank Stocks Plunge As Trump Tariffs Risk Monetary Policy Normalization
MFG,2025-04-04 07:20:42,2025-04-04,"Japan’s Stock Plunge Deepens, Bonds Rally, Rate-Hike Bets Fade","Japan’s Stock Plunge Deepens, Bonds Rally, Rate-Hike Bets Fade"
SMFG,2025-04-04 07:20:42,2025-04-04,"Japan’s Stock Plunge Deepens, Bonds Rally, Rate-Hike Bets Fade","Japan’s Stock Plunge Deepens, Bonds Rally, Rate-Hike Bets Fade"
MFG,2025-04-04 08:16:57,2025-04-04,"Guess, Tesla, Nvidia And Other Big Stocks Moving Lower In Friday's Pre-Market Session","Guess, Tesla, Nvidia And Other Big Stocks Moving Lower In Friday's Pre-Market Session"
MFG,2025-04-06 11:15:17,2025-04-06,S&P500 Fell 9.1% Last Week And These Large Cap Stocks Were Obliterated (Mar 31-Apr 4),S&P500 Fell 9.1% Last Week And These Large Cap Stocks Were Obliterated (Mar 31-Apr 4)
BACHY,2025-04-07 08:30:36,2025-04-07,Chinese Stocks Suffer ‘Panic Selling’ as Tariff War Escalates,Chinese Stocks Suffer ‘Panic Selling’ as Tariff War Escalates
BACHY,2025-04-07 08:46:38,2025-04-07,"China Appeals for Calm, Readies Plans to Counter Trump’s Tariffs","China Appeals for Calm, Readies Plans to Counter Trump’s Tariffs"
CICHY,2025-04-07 09:54:00,2025-04-07,Thornburg Developing World Fund Q4 2024 Commentary,Thornburg Developing World Fund Q4 2024 Commentary
BACHY,2025-04-07 10:30:15,2025-04-07,Emerging Stocks Sink Most Since 2008 as Tariff Turmoil Deepens,Emerging Stocks Sink Most Since 2008 as Tariff Turmoil Deepens
SCGLY,2025-04-07 15:52:00,2025-04-07,__COMPANY__ : Information regarding executed transactions within the framework of a share buyback program (outside the liquidity agreement),Societe Generale: Information regarding executed transactions within the framework of a share buyback program (outside the liquidity agreement)
BACHY,2025-04-08 10:20:02,2025-04-08,China Vows ‘Fight to the End’ on Tariffs as It Props Up Markets,China Vows ‘Fight to the End’ on Tariffs as It Props Up Markets
BACHY,2025-04-08 14:50:24,2025-04-08,"Ransomware attack on vendor exposes DBS, BOC Singapore customer data","Ransomware attack on vendor exposes DBS, BOC Singapore customer data"
SCGLY,2025-04-08 16:16:00,2025-04-08,__COMPANY__ announces results of the offer to purchase certain of its debt securities,Societe Generale announces results of the offer to purchase certain of its debt securities
IDCBY,2025-04-09 04:10:00,2025-04-09,Chinese Banks Risk Losing Momentum In Market Cap Growth Following U.S. Tariffs,Chinese Banks Risk Losing Momentum In Market Cap Growth Following U.S. Tariffs
CICHY,2025-04-09 04:10:00,2025-04-09,Chinese Banks Risk Losing Momentum In Market Cap Growth Following U.S. Tariffs,Chinese Banks Risk Losing Momentum In Market Cap Growth Following U.S. Tariffs
ACGBY,2025-04-09 04:10:00,2025-04-09,Chinese Banks Risk Losing Momentum In Market Cap Growth Following U.S. Tariffs,Chinese Banks Risk Losing Momentum In Market Cap Growth Following U.S. Tariffs
BACHY,2025-04-09 04:10:00,2025-04-09,Chinese Banks Risk Losing Momentum In Market Cap Growth Following U.S. Tariffs,Chinese Banks Risk Losing Momentum In Market Cap Growth Following U.S. Tariffs
MFG,2025-04-09 15:01:32,2025-04-09,Shares of banks and financial services companies are trading higher amid an overall market surge following President Trump's decision to implement a 90-day pause on reciprocal tariffs for all countries except China.,Shares of banks and financial services companies are trading higher amid an overall market surge following President Trump's decision to implement a 90-day pause on reciprocal tariffs for all countries except China.
SMFG,2025-04-09 15:39:04,2025-04-09,Shares of banking companies are trading higher following President Trump's decision to implement a 90-day pause on reciprocal tariffs for all countries except China.,Shares of banking companies are trading higher following President Trump's decision to implement a 90-day pause on reciprocal tariffs for all countries except China.
SCGLY,2025-04-09 16:47:00,2025-04-09,Completion of __COMPANY__ ’s 872 million euros share buyback program for cancellation purpose,Completion of Societe Generale’s 872 million euros share buyback program for cancellation purpose
MFG,2025-04-10 13:20:19,2025-04-10,Shares of companies in the broader financial services sector are trading lower as stocks pull back after surging Wednesday following President Trump's tariff pause announcement.,Shares of companies in the broader financial services sector are trading lower as stocks pull back after surging Wednesday following President Trump's tariff pause announcement.
SMFG,2025-04-10 13:20:19,2025-04-10,Shares of companies in the broader financial services sector are trading lower as stocks pull back after surging Wednesday following President Trump's tariff pause announcement.,Shares of companies in the broader financial services sector are trading lower as stocks pull back after surging Wednesday following President Trump's tariff pause announcement.
MFG,2025-04-10 13:53:00,2025-04-10,"Can __TICKER__ Overcome Lower NII, Fee Revenue and Cost Woes in Q1 Earnings?","Can STT Overcome Lower NII, Fee Revenue and Cost Woes in Q1 Earnings?"
SCGLY,2025-04-10 17:00:00,2025-04-10,"William Connelly, future __COMPANY__ chairman of the board of directors, starting May 2026","William Connelly, future Societe Generale chairman of the board of directors, starting May 2026"
SCBFF,2025-04-10 23:55:00,2025-04-10,Harbor Diversified International All Cap Fund Q4 2024 Commentary,Harbor Diversified International All Cap Fund Q4 2024 Commentary
SMFG,2025-04-11 07:31:46,2025-04-11,Bond Analysts Debate If China Had Role in Treasuries Swings,Bond Analysts Debate If China Had Role in Treasuries Swings
BACHY,2025-04-11 07:31:46,2025-04-11,Bond Analysts Debate If China Had Role in Treasuries Swings,Bond Analysts Debate If China Had Role in Treasuries Swings
ING,2025-04-14 04:07:39,2025-04-14,Investing in __TICKER__ Groep (AMS:INGA) five years ago would have delivered you a 338% gain,Investing in ING Groep (AMS:INGA) five years ago would have delivered you a 338% gain
BACHY,2025-04-14 05:02:43,2025-04-14,China’s Credit Expansion Beats Forecasts on Bond Sale Deluge,China’s Credit Expansion Beats Forecasts on Bond Sale Deluge
BACHY,2025-04-14 09:22:01,2025-04-14,Gold-Trading Frenzy Erupts in China as Tensions With US Escalate,Gold-Trading Frenzy Erupts in China as Tensions With US Escalate
BACHY,2025-04-15 05:31:02,2025-04-15,China gets worst 2025 growth forecast yet with __TICKER__ downgrade,China gets worst 2025 growth forecast yet with UBS downgrade
SCGLY,2025-04-15 16:14:00,2025-04-15,__COMPANY__ : Availability or consultation of the information relating to the combined General Meeting of Shareholders dated 20 May 2025,Societe Generale: Availability or consultation of the information relating to the combined General Meeting of Shareholders dated 20 May 2025
BACHY,2025-04-16 06:43:17,2025-04-16,Strong China GDP Growth Fails to Stem Calls for Urgent Stimulus,Strong China GDP Growth Fails to Stem Calls for Urgent Stimulus
MFG,2025-04-16 15:38:47,2025-04-16,5 Tariff-Resistant International Stocks With Dividends,5 Tariff-Resistant International Stocks With Dividends
SCGLY,2025-04-17 10:38:15,2025-04-17,Could A Recession Accelerate AI Adoption And Turn Palantir To A Defensive Play?,Could A Recession Accelerate AI Adoption And Turn Palantir To A Defensive Play?
SCGLY,2025-04-17 12:48:00,2025-04-17,"__COMPANY__ Group: Strong Industry, Solid Earnings Estimate Revisions","Societe Generale Group: Strong Industry, Solid Earnings Estimate Revisions"
MFG,2025-04-17 14:57:35,2025-04-17,"Shares of US-listed Japanese banking companies are trading higher amid US-Japan trade negotiations. Japan's adjusted trade balance data may indicate strength in the Yen, which may support BOJ policymaker desires.","Shares of US-listed Japanese banking companies are trading higher amid US-Japan trade negotiations. Japan's adjusted trade balance data may indicate strength in the Yen, which may support BOJ policymaker desires."
SMFG,2025-04-17 14:57:35,2025-04-17,"Shares of US-listed Japanese banking companies are trading higher amid US-Japan trade negotiations. Japan's adjusted trade balance data may indicate strength in the Yen, which may support BOJ policymaker desires.","Shares of US-listed Japanese banking companies are trading higher amid US-Japan trade negotiations. Japan's adjusted trade balance data may indicate strength in the Yen, which may support BOJ policymaker desires."
SMFG,2025-04-18 07:21:48,2025-04-18,Asian Stocks Edge Higher in Thin Holiday Trading: Markets Wrap,Asian Stocks Edge Higher in Thin Holiday Trading: Markets Wrap
SCBFF,2025-04-21 07:41:47,2025-04-21,"__COMPANY__ , __COMPANY__ Reportedly Looking Into Expanding To US Crypto Market","Deutsche Bank, Standard Chartered Reportedly Looking Into Expanding To US Crypto Market"
SCGLY,2025-04-21 13:11:24,2025-04-21,Portfolio Performance Q1 2025,Portfolio Performance Q1 2025
ING,2025-04-21 14:55:35,2025-04-21,Oil Declines on Fear Trade War Will Weaken Global Energy Demand,Oil Declines on Fear Trade War Will Weaken Global Energy Demand
MFG,2025-04-22 08:04:53,2025-04-22,__COMPANY__ and Rakuten's advisory venture targets $360 million in assets by 2029,Mizuho and Rakuten's advisory venture targets $360 million in assets by 2029
MFG,2025-04-22 09:30:00,2025-04-22,Trump’s FDA Sends a Bullish Signal to Biotech,Trump’s FDA Sends a Bullish Signal to Biotech
SCGLY,2025-04-22 09:50:14,2025-04-22,Strategist Who Called End of US Exceptionalism Sees No Recovery,Strategist Who Called End of US Exceptionalism Sees No Recovery
SCGLY,2025-04-22 14:39:33,2025-04-22,Vanguard CEO Says US Exceptionalism ‘Absolutely’ Hasn’t Peaked,Vanguard CEO Says US Exceptionalism ‘Absolutely’ Hasn’t Peaked
ING,2025-04-22 15:46:44,2025-04-22,Shares of banking companies are trading higher amid Treasury Secretary Scott Bessent's remarks about trade de-escalation with China.,Shares of banking companies are trading higher amid Treasury Secretary Scott Bessent's remarks about trade de-escalation with China.
ING,2025-04-22 17:57:00,2025-04-22,Results of __TICKER__ ’s 2025 Annual General Meeting,Results of ING’s 2025 Annual General Meeting
ING,2025-04-23 13:18:42,2025-04-23,"Shares of banking companies are trading higher amid overall market strength after President Trump said he will not be firing Fed Chair Powell. Additionally, Trump indicated the final tariff rate would be lower than the current, which may lead to greater business and lending activity for financial institutions.","Shares of banking companies are trading higher amid overall market strength after President Trump said he will not be firing Fed Chair Powell. Additionally, Trump indicated the final tariff rate would be lower than the current, which may lead to greater business and lending activity for financial institutions."
SCBFF,2025-04-24 00:00:00,2025-04-24,Crude Caught in Crossfire of OPEC+ Discord and Tariff Shocks,Crude Caught in Crossfire of OPEC+ Discord and Tariff Shocks
ING,2025-04-24 09:03:37,2025-04-24,"Out Of 70 Graham Value All-Stars, These 16 'Safer' Stocks Stand Out For April","Out Of 70 Graham Value All-Stars, These 16 'Safer' Stocks Stand Out For April"
ING,2025-04-24 10:00:00,2025-04-24,Aristotle International Equity ADR Q1 2025 Commentary,Aristotle International Equity ADR Q1 2025 Commentary
ING,2025-04-24 10:31:33,2025-04-24,3 European Dividend Stocks With Up To 7.4% Yield,3 European Dividend Stocks With Up To 7.4% Yield
MFG,2025-04-24 12:24:26,2025-04-24,"__COMPANY__ , Inc. - Depositary Receipt () __TICKER__ Price Target Increased by 81.22% to 13.06","Mizuho Financial Group, Inc. - Depositary Receipt () (MFG) Price Target Increased by 81.22% to 13.06"
SCGLY,2025-04-25 05:00:19,2025-04-25,"Stocks to watch next week: Apple, Microsoft, Shell, __TICKER__ , Lloyds and AstraZeneca","Stocks to watch next week: Apple, Microsoft, Shell, HSBC, Lloyds and AstraZeneca"
IDCBY,2025-04-25 05:00:19,2025-04-25,"Stocks to watch next week: Apple, Microsoft, Shell, __TICKER__ , Lloyds and AstraZeneca","Stocks to watch next week: Apple, Microsoft, Shell, HSBC, Lloyds and AstraZeneca"
CICHY,2025-04-25 05:00:19,2025-04-25,"Stocks to watch next week: Apple, Microsoft, Shell, __TICKER__ , Lloyds and AstraZeneca","Stocks to watch next week: Apple, Microsoft, Shell, HSBC, Lloyds and AstraZeneca"
ING,2025-04-25 05:00:19,2025-04-25,"Stocks to watch next week: Apple, Microsoft, Shell, __TICKER__ , Lloyds and AstraZeneca","Stocks to watch next week: Apple, Microsoft, Shell, HSBC, Lloyds and AstraZeneca"
ACGBY,2025-04-25 05:00:19,2025-04-25,"Stocks to watch next week: Apple, Microsoft, Shell, __TICKER__ , Lloyds and AstraZeneca","Stocks to watch next week: Apple, Microsoft, Shell, HSBC, Lloyds and AstraZeneca"
SCBFF,2025-04-25 05:00:19,2025-04-25,"Stocks to watch next week: Apple, Microsoft, Shell, __TICKER__ , Lloyds and AstraZeneca","Stocks to watch next week: Apple, Microsoft, Shell, HSBC, Lloyds and AstraZeneca"
SCGLY,2025-04-25 13:40:09,2025-04-25,Are Investors Undervaluing Banco __COMPANY__ Chile (BSAC) Right Now?,Are Investors Undervaluing Banco Santander Chile (BSAC) Right Now?
SCGLY,2025-04-28 10:13:16,2025-04-28,__COMPANY__ ’s Wilson Says Weak Dollar Will Buoy US Stocks,Morgan Stanley’s Wilson Says Weak Dollar Will Buoy US Stocks
SCBFF,2025-04-28 11:34:08,2025-04-28,"__COMPANY__ sees weaker U.S. dollar, raises EUR/USD forecast to 1.16","StanChart sees weaker U.S. dollar, raises EUR/USD forecast to 1.16"
ING,2025-04-28 15:45:12,2025-04-28,This is Why __TICKER__ Groep __TICKER__ is a Great Dividend Stock,This is Why ING Groep (ING) is a Great Dividend Stock
SMFG,2025-04-29 04:20:00,2025-04-29,Japanese Banks Brace For Higher Credit Costs As Tariff Risks Mount,Japanese Banks Brace For Higher Credit Costs As Tariff Risks Mount
MFG,2025-04-29 04:20:00,2025-04-29,Japanese Banks Brace For Higher Credit Costs As Tariff Risks Mount,Japanese Banks Brace For Higher Credit Costs As Tariff Risks Mount
BCMXY,2025-04-29 05:40:42,2025-04-29,__TICKER__ sees up to $1.6 billion in loss on China bank stake reduction,HSBC sees up to $1.6 billion in loss on China bank stake reduction
SMFG,2025-04-29 13:00:00,2025-04-29,__COMPANY__ Americas Hires Greg Keeley as Chief Operating Officer,SMBC Americas Hires Greg Keeley as Chief Operating Officer
BCMXY,2025-04-29 14:17:45,2025-04-29,__TICKER__ Braces for $1.6 Billion Hit in China Shakeup -- But Investors Are Getting a $3 Billion Surprise,HSBC Braces for $1.6 Billion Hit in China Shakeup -- But Investors Are Getting a $3 Billion Surprise
SCBFF,2025-04-29 14:19:54,2025-04-29,"Bitcoin Outshines Gold, Tech Stocks in April Amid Tariff Turmoil","Bitcoin Outshines Gold, Tech Stocks in April Amid Tariff Turmoil"
BACHY,2025-04-30 04:00:48,2025-04-30,"Chinese Bank Shares Slump as Earnings Show Margin, Profit Pain","Chinese Bank Shares Slump as Earnings Show Margin, Profit Pain"
CICHY,2025-04-30 04:00:48,2025-04-30,"Chinese Bank Shares Slump as Earnings Show Margin, Profit Pain","Chinese Bank Shares Slump as Earnings Show Margin, Profit Pain"
SCGLY,2025-04-30 04:25:00,2025-04-30,__COMPANY__ : First quarter 2025 earnings,Societe Generale: First quarter 2025 earnings
SCGLY,2025-04-30 08:51:09,2025-04-30,__TICKER__ Traders Aid Profit Beat as Ermotti Warns on Tariffs,UBS Traders Aid Profit Beat as Ermotti Warns on Tariffs
SCGLY,2025-04-30 17:33:00,2025-04-30,__COMPANY__ : Availability of the first amendment to 2025 Universal Registration Document,Societe Generale: Availability of the first amendment to 2025 Universal Registration Document
SMFG,2025-04-30 22:20:00,2025-04-30,Templeton Foreign Fund Q1 2025 Commentary,Templeton Foreign Fund Q1 2025 Commentary
SCBFF,2025-04-30 22:20:00,2025-04-30,Templeton Foreign Fund Q1 2025 Commentary,Templeton Foreign Fund Q1 2025 Commentary
SCGLY,2025-05-01 01:00:17,2025-05-01,__COMPANY__ Société anonyme __TICKER__ Q1 2025 Earnings Call Transcript,Société Générale Société anonyme (SCGLY) Q1 2025 Earnings Call Transcript
MFG,2025-05-01 12:38:14,2025-05-01,__COMPANY__ Americas Renews Title Sponsor Agreement For __COMPANY__ Americas Open Through 2030; To Raise 2026 Purse To $3.25M,Mizuho Americas Renews Title Sponsor Agreement For Mizuho Americas Open Through 2030; To Raise 2026 Purse To $3.25M
MFG,2025-05-01 14:45:27,2025-05-01,__COMPANY__ downgraded to Neutral from Buy at __COMPANY__,Mitsubishi UFJ downgraded to Neutral from Buy at BofA
MFG,2025-05-01 16:30:00,2025-05-01,"__COMPANY__ Americas Announces Five-Year Renewal Agreement With the LPGA Tour as Title Sponsor of the __COMPANY__ Americas Open, Reinforcing Its Commitment to Women’s Sports","Mizuho Americas Announces Five-Year Renewal Agreement With the LPGA Tour as Title Sponsor of the Mizuho Americas Open, Reinforcing Its Commitment to Women’s Sports"
ING,2025-05-01 23:29:00,2025-05-01,Templeton International ADR Equity SMA Q1 2025 Commentary,Templeton International ADR Equity SMA Q1 2025 Commentary
ING,2025-05-02 03:33:25,2025-05-02,"__TICKER__ Groep Q1 EPS $0.49 Beats $0.46 Estimate, Sales $5.93B Beat $5.60B Estimate","ING Groep Q1 EPS $0.49 Beats $0.46 Estimate, Sales $5.93B Beat $5.60B Estimate"
ING,2025-05-02 04:32:20,2025-05-02,"Earnings Scheduled For May 2, 2025","Earnings Scheduled For May 2, 2025"
SCBFF,2025-05-02 04:55:32,2025-05-02,__COMPANY__ cautious on tariff impact after strong first quarter,StanChart cautious on tariff impact after strong first quarter
ING,2025-05-02 04:59:00,2025-05-02,"__TICKER__ posts 1Q2025 net result of €1,455 million, with strong growth in customer balances and fee income","ING posts 1Q2025 net result of €1,455 million, with strong growth in customer balances and fee income"
ING,2025-05-02 05:05:00,2025-05-02,__TICKER__ completes share buyback and announces new programme of up to €2.0 billion,ING completes share buyback and announces new programme of up to €2.0 billion
SCBFF,2025-05-02 07:03:00,2025-05-02,"__COMPANY__ Posts Profit Growth, Maintains Guidance","Standard Chartered Posts Profit Growth, Maintains Guidance"
ING,2025-05-02 07:18:13,2025-05-02,__TICKER__ Groep shares are trading higher after the company reported better-than-expected Q1 EPS and sales.,ING Groep shares are trading higher after the company reported better-than-expected Q1 EPS and sales.
SCBFF,2025-05-02 08:51:34,2025-05-02,"Trending tickers: Apple, Amazon, Reddit, Airbnb and __COMPANY__","Trending tickers: Apple, Amazon, Reddit, Airbnb and Standard Chartered"
ING,2025-05-02 09:02:36,2025-05-02,__TICKER__ : Q1 Earnings Snapshot,ING: Q1 Earnings Snapshot
ING,2025-05-02 09:25:00,2025-05-02,"Dutch Bank __TICKER__ Beats Views, Lifting Shares","Dutch Bank ING Beats Views, Lifting Shares"
SCBFF,2025-05-02 09:55:10,2025-05-02,Trade-Focused __COMPANY__ Spots Opportunities in Tariff Chaos,Trade-Focused StanChart Spots Opportunities in Tariff Chaos
SCBFF,2025-05-02 14:56:40,2025-05-02,__COMPANY__ PLC __TICKER__ Q1 2025 Earnings Call Transcript,Standard Chartered PLC (SCBFF) Q1 2025 Earnings Call Transcript
SCBFF,2025-05-02 14:57:28,2025-05-02,__COMPANY__ PLC 2025 Q1 - Results - Earnings Call Presentation,Standard Chartered PLC 2025 Q1 - Results - Earnings Call Presentation
ING,2025-05-02 16:00:09,2025-05-02,Are You Looking for a Top Momentum Pick? Why __TICKER__ Groep __TICKER__ is a Great Choice,Are You Looking for a Top Momentum Pick? Why ING Groep (ING) is a Great Choice
SCBFF,2025-05-02 17:29:38,2025-05-02,FTSE surges to longest winning streak on record,FTSE surges to longest winning streak on record
ING,2025-05-02 20:58:33,2025-05-02,__TICKER__ Groep N.V. __TICKER__ Q1 2025 Earnings Call Transcript,ING Groep N.V. (ING) Q1 2025 Earnings Call Transcript
ING,2025-05-02 21:14:09,2025-05-02,__TICKER__ Groep N.V. 2025 Q1 - Results - Earnings Call Presentation,ING Groep N.V. 2025 Q1 - Results - Earnings Call Presentation
SCBFF,2025-05-03 07:00:39,2025-05-03,__COMPANY__ PLC __TICKER__ Q1 2025 Earnings Call Highlights: Strong Profit Growth Amid ...,Standard Chartered PLC (SCBFF) Q1 2025 Earnings Call Highlights: Strong Profit Growth Amid ...
ING,2025-05-03 07:00:41,2025-05-03,__TICKER__ Groep NV __TICKER__ Q1 2025 Earnings Call Highlights: Strong Growth in Deposits and Sustainable ...,ING Groep NV (ING) Q1 2025 Earnings Call Highlights: Strong Growth in Deposits and Sustainable ...
SCBFF,2025-05-04 08:24:41,2025-05-04,__COMPANY__ First Quarter 2025 Earnings: EPS Beats Expectations,Standard Chartered First Quarter 2025 Earnings: EPS Beats Expectations
SMFG,2025-05-04 23:47:15,2025-05-04,Warren Buffett And His Successor Greg Abel Say Berkshire Hathaway Could Hold This $20B Bet For '50 Years Or Forever',Warren Buffett And His Successor Greg Abel Say Berkshire Hathaway Could Hold This $20B Bet For '50 Years Or Forever'
SCGLY,2025-05-05 07:04:01,2025-05-05,European Firms Fare Better Than Feared Through Early Trade Pain,European Firms Fare Better Than Feared Through Early Trade Pain
ING,2025-05-05 08:44:31,2025-05-05,__TICKER__ Groep First Quarter 2025 Earnings: EPS Beats Expectations,ING Groep First Quarter 2025 Earnings: EPS Beats Expectations
ING,2025-05-05 12:04:04,2025-05-05,__TICKER__ Groep: Share Buyback Presents An Exit Opportunity,ING Groep: Share Buyback Presents An Exit Opportunity
SCGLY,2025-05-06 06:51:41,2025-05-06,Surging Asian Currencies Spur Hunt for Winners in Stock Markets,Surging Asian Currencies Spur Hunt for Winners in Stock Markets
CICHY,2025-05-06 10:45:00,2025-05-06,Fidelity Emerging Markets Fund Q1 2025 Commentary,Fidelity Emerging Markets Fund Q1 2025 Commentary
SMFG,2025-05-06 12:04:00,2025-05-06,"Japanese, Singaporean Banks Lead Capital Raising Recovery In Asia-Pacific","Japanese, Singaporean Banks Lead Capital Raising Recovery In Asia-Pacific"
MFG,2025-05-06 17:00:00,2025-05-06,__COMPANY__ Names 2023 __COMPANY__ Americas Open Junior Winner Yana Wilson as Brand Ambassador,Mizuho Names 2023 Mizuho Americas Open Junior Winner Yana Wilson as Brand Ambassador
BACHY,2025-05-07 04:48:37,2025-05-07,"China Cuts Key Rate, Reserve Ratio to Aid Economy Hit by Tariffs","China Cuts Key Rate, Reserve Ratio to Aid Economy Hit by Tariffs"
BACHY,2025-05-07 05:45:14,2025-05-07,Chinese Regulator Applauds Warren Buffett’s Long-Term Approach,Chinese Regulator Applauds Warren Buffett’s Long-Term Approach
BACHY,2025-05-07 11:55:36,2025-05-07,China Keeps Adding Gold to Reserves as Challenges Stack Up,China Keeps Adding Gold to Reserves as Challenges Stack Up
SCGLY,2025-05-07 13:27:26,2025-05-07,__COMPANY__ on What's Next for The Taiwan Dollar After Recent Jump,SocGen on What's Next for The Taiwan Dollar After Recent Jump
MFG,2025-05-07 14:06:00,2025-05-07,__COMPANY__ Americas Hires Lloyd Walmsley as Managing Director and Senior Equity Research Analyst Covering the Internet Sector,Mizuho Americas Hires Lloyd Walmsley as Managing Director and Senior Equity Research Analyst Covering the Internet Sector
SCGLY,2025-05-07 15:48:00,2025-05-07,__COMPANY__ : shares & voting rights as of 30 April 2025,Societe Generale: shares & voting rights as of 30 April 2025
CICHY,2025-05-08 09:10:00,2025-05-08,Templeton Dragon Fund Inc Q1 2025 Commentary,Templeton Dragon Fund Inc Q1 2025 Commentary
SCBFF,2025-05-08 10:17:32,2025-05-08,__COMPANY__ says its trade business resilient to Trump tariff disruption,StanChart says its trade business resilient to Trump tariff disruption
SMFG,2025-05-09 10:42:57,2025-05-09,Japan's __COMPANY__ to take 20% stake in India's Yes Bank,Japan's SMBC to take 20% stake in India's Yes Bank
SMFG,2025-05-10 19:00:00,2025-05-10,Wall Street Plays Long Game as Deals Go Private,Wall Street Plays Long Game as Deals Go Private
SCGLY,2025-05-11 01:38:00,2025-05-11,Invesco Oppenheimer International Growth Fund Q1 2025 Commentary,Invesco Oppenheimer International Growth Fund Q1 2025 Commentary
SCBFF,2025-05-11 01:45:00,2025-05-11,Invesco Short Term Bond Fund Q1 2025 Commentary,Invesco Short Term Bond Fund Q1 2025 Commentary
