stock,date,date_only,headline,headline_raw
BACHY,2025-09-11 03:05:00,2025-09-11,Chinese Megabanks Face Headwinds In Maintaining Earnings Momentum,Chinese Megabanks Face Headwinds In Maintaining Earnings Momentum
IDCBY,2025-09-11 03:05:00,2025-09-11,Chinese Megabanks Face Headwinds In Maintaining Earnings Momentum,Chinese Megabanks Face Headwinds In Maintaining Earnings Momentum
CICHY,2025-09-11 03:05:00,2025-09-11,Chinese Megabanks Face Headwinds In Maintaining Earnings Momentum,Chinese Megabanks Face Headwinds In Maintaining Earnings Momentum
MUFG,2025-09-11 10:30:00,2025-09-11,New Strong Buy Stocks for September 11th,New Strong Buy Stocks for September 11th
SAN,2025-09-11 11:24:00,2025-09-11,INDAQUA successfully completes €358m financing,INDAQUA successfully completes €358m financing
SAN,2025-09-11 11:33:09,2025-09-11,Lenders raise mortgage rates ahead of interest rate decision,Lenders raise mortgage rates ahead of interest rate decision
MUFG,2025-09-11 11:51:26,2025-09-11,"Euro Continues to Consolidate at Stronger Levels Ahead of ECB Update, Notes Mitsubishi UFG","Euro Continues to Consolidate at Stronger Levels Ahead of ECB Update, Notes Mitsubishi UFG"
DB,2025-09-11 12:11:06,2025-09-11,"' __COMPANY__ , __COMPANY__ Lead €750 Million Kelvion Buyout Debt'- Bloomberg","'JPMorgan, Deutsche Bank Lead €750 Million Kelvion Buyout Debt'- Bloomberg"
RY,2025-09-11 12:31:48,2025-09-11,TSX's Top Dividend Stocks For September 2025,TSX's Top Dividend Stocks For September 2025
SCGLY,2025-09-11 12:47:18,2025-09-11,__COMPANY__ (ENXTPA:GLE): Assessing Valuation After Recent Share Price Movements Catch Investor Attention,Société Générale (ENXTPA:GLE): Assessing Valuation After Recent Share Price Movements Catch Investor Attention
DB,2025-09-11 12:47:39,2025-09-11,Leadership Shakeup and Bond Issuances Could Be a Game Changer for __COMPANY__ (XTRA:DBK),Leadership Shakeup and Bond Issuances Could Be a Game Changer for Deutsche Bank (XTRA:DBK)
MUFG,2025-09-11 15:00:00,2025-09-11,Best Momentum Stocks to Buy for September 11th,Best Momentum Stocks to Buy for September 11th
BNPQY,2025-09-11 15:08:00,2025-09-11,Nvidia Stock Rises After Upgrade. The Case to Buy Amid Oracle AI Surge.,Nvidia Stock Rises After Upgrade. The Case to Buy Amid Oracle AI Surge.
MUFG,2025-09-11 15:23:00,2025-09-11,__TICKER__ Shares Reach 52-Week High: Is There Further Upside Potential?,HSBC Shares Reach 52-Week High: Is There Further Upside Potential?
HSBC,2025-09-11 15:23:00,2025-09-11,__TICKER__ Shares Reach 52-Week High: Is There Further Upside Potential?,HSBC Shares Reach 52-Week High: Is There Further Upside Potential?
TD,2025-09-11 15:33:06,2025-09-11,__COMPANY__ Bank __TICKER__ Discloses Prospectus for $40B Global Note Program,Toronto-Dominion Bank (TD) Discloses Prospectus for $40B Global Note Program
CICHY,2025-09-11 16:15:00,2025-09-11,"Factoring Market to Grow by $2.2 Trillion During 2025-2029: __COMPANY__ , __COMPANY__ , __COMPANY__ , __COMPANY__ , and __TICKER__ Group Lead the Industry","Factoring Market to Grow by $2.2 Trillion During 2025-2029: Societe Generale, BNP Paribas, China Construction Bank, Deutsche Bank, and HSBC Group Lead the Industry"
BNPQY,2025-09-11 16:15:00,2025-09-11,"Factoring Market to Grow by $2.2 Trillion During 2025-2029: __COMPANY__ , __COMPANY__ , __COMPANY__ , __COMPANY__ , and __TICKER__ Group Lead the Industry","Factoring Market to Grow by $2.2 Trillion During 2025-2029: Societe Generale, BNP Paribas, China Construction Bank, Deutsche Bank, and HSBC Group Lead the Industry"
MUFG,2025-09-11 17:13:16,2025-09-11,Tata Motors arranges $4.5bn bridge loan for Iveco acquisition,Tata Motors arranges $4.5bn bridge loan for Iveco acquisition
BNPQY,2025-09-11 17:28:00,2025-09-11,Klarna Completes Initial Public Offering,Klarna Completes Initial Public Offering
DB,2025-09-11 17:50:09,2025-09-11,"Market Chatter: Apollo Secures 750 Million Euros Debt Financing From __COMPANY__ , __COMPANY__ for Kelvion Deal","Market Chatter: Apollo Secures 750 Million Euros Debt Financing From JPMorgan, Deutsche Bank for Kelvion Deal"
BNPQY,2025-09-11 18:15:37,2025-09-11,__COMPANY__ Exane Touts Nokia Corp (NOK) Prospects Amid AI and Data Center Opportunity,BNP Paribas Exane Touts Nokia Corp (NOK) Prospects Amid AI and Data Center Opportunity
DB,2025-09-11 18:56:29,2025-09-11,Sector Update: Financial Stocks Advance in Afternoon Trading,Sector Update: Financial Stocks Advance in Afternoon Trading
BNPQY,2025-09-11 19:34:00,2025-09-11,Dollar Under Pressure as Fed Looks Poised to Cut While EU Holds,Dollar Under Pressure as Fed Looks Poised to Cut While EU Holds
BNPQY,2025-09-12 04:00:49,2025-09-12,GreenIT Secures €370 Million Financing for Italian Renewable Projects,GreenIT Secures €370 Million Financing for Italian Renewable Projects
RY,2025-09-12 05:02:59,2025-09-12,"CIBC Downgrades __COMPANY__ __TICKER__ To Neutral, Keeps the PT","CIBC Downgrades Royal Bank of Canada (RY) To Neutral, Keeps the PT"
BNPQY,2025-09-12 10:28:45,2025-09-12,Board of Spain's Sabadell bank rejects BBVA takeover bid,Board of Spain's Sabadell bank rejects BBVA takeover bid
SAN,2025-09-12 10:28:45,2025-09-12,Board of Spain's Sabadell bank rejects BBVA takeover bid,Board of Spain's Sabadell bank rejects BBVA takeover bid
MUFG,2025-09-12 12:30:00,2025-09-12,"LogProstyle Inc. Announces Company Shares Now Available for Trading Through __COMPANY__ __COMPANY__ Securities Co., Ltd.","LogProstyle Inc. Announces Company Shares Now Available for Trading Through Mitsubishi UFJ Morgan Stanley Securities Co., Ltd."
MUFG,2025-09-12 12:42:40,2025-09-12,"Canadian Industrial Capacity Use Slips to 79.3% in Q2, Tops Forecast","Canadian Industrial Capacity Use Slips to 79.3% in Q2, Tops Forecast"
BCMXY,2025-09-12 13:28:00,2025-09-12,AM Best Affirms Credit Ratings of China BOCOM Insurance Company Limited,AM Best Affirms Credit Ratings of China BOCOM Insurance Company Limited
SAN,2025-09-12 15:25:26,2025-09-12,Is the 'bank of mum and dad' needed to get on the property ladder? How readers voted,Is the 'bank of mum and dad' needed to get on the property ladder? How readers voted
HSBC,2025-09-12 15:25:26,2025-09-12,Is the 'bank of mum and dad' needed to get on the property ladder? How readers voted,Is the 'bank of mum and dad' needed to get on the property ladder? How readers voted
MUFG,2025-09-12 16:12:59,2025-09-12,Zoetis Inc. (ZTS) Secures a New Five-Year $1.25 Billion Senior Unsecured Revolving Credit Facility,Zoetis Inc. (ZTS) Secures a New Five-Year $1.25 Billion Senior Unsecured Revolving Credit Facility
DB,2025-09-12 17:00:48,2025-09-12,"__COMPANY__ , __COMPANY__ Boost Forecasts for Fed Cuts","Morgan Stanley, Deutsche Bank Boost Forecasts for Fed Cuts"
HSBC,2025-09-12 18:12:00,2025-09-12,"__TICKER__ Targets 20% Asia Hiring Boost to Ride Digital, Trade Growth","JPM Targets 20% Asia Hiring Boost to Ride Digital, Trade Growth"
RY,2025-09-12 18:33:00,2025-09-12,Canada's Big Banks Sidestep Tariff Fallout - What Investors Should Watch For Next,Canada's Big Banks Sidestep Tariff Fallout - What Investors Should Watch For Next
TD,2025-09-12 22:26:00,2025-09-12,__TICKER__ Announces Pricing of USD Non-Viability Contingent Capital AT1 Limited Recourse Capital Notes,TD Announces Pricing of USD Non-Viability Contingent Capital AT1 Limited Recourse Capital Notes
HSBC,2025-09-13 13:40:30,2025-09-13,Is __TICKER__ ( __TICKER__ ) Overvalued After Recent Surge? A Closer Look at Its Current Valuation,Is HSBC (LSE:HSBA) Overvalued After Recent Surge? A Closer Look at Its Current Valuation
HSBC,2025-09-13 14:53:20,2025-09-13,__TICKER__ : Wall Street Underestimating Advanced Micro Devices Inc. (AMD)’s AI GPU Business,HSBC: Wall Street Underestimating Advanced Micro Devices Inc. (AMD)’s AI GPU Business
RY,2025-09-14 05:17:22,2025-09-14,CIBC Downgrades __COMPANY__ __TICKER__ to Neutral From Outperform,CIBC Downgrades Royal Bank of Canada (RY) to Neutral From Outperform
SMFG,2025-09-14 12:24:07,2025-09-14,__COMPANY__ FG ( __TICKER__ ): Assessing Valuation After a Period of Strong Shareholder Returns,Sumitomo Mitsui FG (TSE:8316): Assessing Valuation After a Period of Strong Shareholder Returns
HSBC,2025-09-15 03:50:02,2025-09-15,__TICKER__ 's Liu on China's Investment Slump,HSBC's Liu on China's Investment Slump
TD,2025-09-15 10:45:00,2025-09-15,Chart Of The Day: One Toronto Chart That Tells This Market's Story,Chart Of The Day: One Toronto Chart That Tells This Market's Story
RY,2025-09-15 10:45:00,2025-09-15,Chart Of The Day: One Toronto Chart That Tells This Market's Story,Chart Of The Day: One Toronto Chart That Tells This Market's Story
MUFG,2025-09-15 10:54:45,2025-09-15,"Weak China Activity Data Dampens Expectations for Currency Strength, Says Mitsubishi UFG","Weak China Activity Data Dampens Expectations for Currency Strength, Says Mitsubishi UFG"
BNPQY,2025-09-15 11:40:35,2025-09-15,Has __COMPANY__ Stock Been Left Behind or Is Stability Hiding Potential for 2025?,Has BNP Paribas Stock Been Left Behind or Is Stability Hiding Potential for 2025?
MUFG,2025-09-15 12:48:17,2025-09-15,"Canadian Manufacturing Sales Rise 2.5% in July, Topping Forecasts on Strong Transportation Demand","Canadian Manufacturing Sales Rise 2.5% in July, Topping Forecasts on Strong Transportation Demand"
DB,2025-09-15 13:55:00,2025-09-15,NYSE Content Advisory: Pre-Market Update + S&P comes off best week since August,NYSE Content Advisory: Pre-Market Update + S&P comes off best week since August
DB,2025-09-15 16:05:36,2025-09-15,"Arqit Quantum To Pay $1M And Issue 48,561 Shares To __COMPANY__ For Advisory Services Related To 2021 Business Combination","Arqit Quantum To Pay $1M And Issue 48,561 Shares To Deutsche Bank For Advisory Services Related To 2021 Business Combination"
DB,2025-09-15 17:39:00,2025-09-15,Capital One Files Lawsuit Against FDIC Over Erroneous Charges,Capital One Files Lawsuit Against FDIC Over Erroneous Charges
HSBC,2025-09-15 19:10:00,2025-09-15,__TICKER__ Group AG Mulls U.S. Relocation as Swiss Capital Rules Tighten,UBS Group AG Mulls U.S. Relocation as Swiss Capital Rules Tighten
HSBC,2025-09-16 00:01:00,2025-09-16,UK firms trading more with the US as they pivot from goods to services – __TICKER__,UK firms trading more with the US as they pivot from goods to services – HSBC
BNPQY,2025-09-16 06:00:00,2025-09-16,__COMPANY__ : __COMPANY__ SETS ROTE AMBITION AT 13% IN 2028 - CET1 ratio expected at 12.5% by end-2027,BNP PARIBAS: BNP PARIBAS SETS ROTE AMBITION AT 13% IN 2028 - CET1 ratio expected at 12.5% by end-2027
UBS,2025-09-16 08:13:50,2025-09-16,__TICKER__ Group AG (UBSS:CA) Presents at __COMPANY__ 30th Annual Financials CEO Conference 2025 Transcript,UBS Group AG (UBSS:CA) Presents at Bank of America 30th Annual Financials CEO Conference 2025 Transcript
BNPQY,2025-09-16 08:21:21,2025-09-16,Investment-Grade Private Credit Needs Bank Partnerships: Apollo,Investment-Grade Private Credit Needs Bank Partnerships: Apollo
SCGLY,2025-09-16 08:33:49,2025-09-16,__COMPANY__ Société anonyme __TICKER__ Presents at __COMPANY__ 30th Annual Financials CEO Conference 2025 Transcript,Société Générale Société anonyme (SCGLY) Presents at Bank of America 30th Annual Financials CEO Conference 2025 Transcript
BNPQY,2025-09-16 09:44:00,2025-09-16,__COMPANY__ Targets Higher Profitability in 2028,BNP Paribas Targets Higher Profitability in 2028
RY,2025-09-16 11:01:00,2025-09-16,Canadian entrepreneurship aspirations hit an eight-year high: __COMPANY__ Poll,Canadian entrepreneurship aspirations hit an eight-year high: RBC Poll
BNPQY,2025-09-16 11:03:00,2025-09-16,Stabilization Notice - SAMMONTANA pre stab,Stabilization Notice - SAMMONTANA pre stab
SAN,2025-09-16 12:25:33,2025-09-16,Blackstone Energy to acquire Hill Top Energy Center for nearly $1bn,Blackstone Energy to acquire Hill Top Energy Center for nearly $1bn
MUFG,2025-09-16 12:33:40,2025-09-16,"Canada Housing Starts Drop 16% in August, Miss __TICKER__ Forecast","Canada Housing Starts Drop 16% in August, Miss MUFG Forecast"
SAN,2025-09-16 14:00:00,2025-09-16,Flatiron Reaches Financial Close on Largest Battery Energy Storage Project in Massachusetts,Flatiron Reaches Financial Close on Largest Battery Energy Storage Project in Massachusetts
TD,2025-09-16 14:02:00,2025-09-16,__TICKER__ Bank Announces Marc Womack as Head of U.S. Consumer Deposit and Payment Products,TD Bank Announces Marc Womack as Head of U.S. Consumer Deposit and Payment Products
SAN,2025-09-16 14:02:00,2025-09-16,__TICKER__ Bank Announces Marc Womack as Head of U.S. Consumer Deposit and Payment Products,TD Bank Announces Marc Womack as Head of U.S. Consumer Deposit and Payment Products
SAN,2025-09-16 14:11:03,2025-09-16,"__COMPANY__ ’s Openbank Starts Offering Crypto Trading in Germany, Spain Coming Soon","Santander’s Openbank Starts Offering Crypto Trading in Germany, Spain Coming Soon"
SAN,2025-09-16 16:14:42,2025-09-16,__COMPANY__ ’s Openbank Launches Crypto Trading for German Clients,Santander’s Openbank Launches Crypto Trading for German Clients
HSBC,2025-09-16 17:38:00,2025-09-16,__COMPANY__ Touches 52-Week High: How to Approach the Stock Now?,Barclays Touches 52-Week High: How to Approach the Stock Now?
MUFG,2025-09-16 18:35:00,2025-09-16,Valeo announces a new green bond issue for an amount of 500 million euros with maturity March 2032,Valeo announces a new green bond issue for an amount of 500 million euros with maturity March 2032
BNPQY,2025-09-16 18:35:00,2025-09-16,Valeo announces a new green bond issue for an amount of 500 million euros with maturity March 2032,Valeo announces a new green bond issue for an amount of 500 million euros with maturity March 2032
TD,2025-09-16 22:36:00,2025-09-16,__TICKER__ Announces Pricing of Japanese Yen NVCC Subordinated Debentures,TD Announces Pricing of Japanese Yen NVCC Subordinated Debentures
BCS,2025-09-17 04:58:25,2025-09-17,__COMPANY__ CFO Says Bank Will Allocate More Capital Toward UK Businesses Beyond 2026 While Keeping Investment Bank Capital Flat,Barclays CFO Says Bank Will Allocate More Capital Toward UK Businesses Beyond 2026 While Keeping Investment Bank Capital Flat
BCS,2025-09-17 05:53:49,2025-09-17,__COMPANY__ PLC __TICKER__ Presents at __COMPANY__ 30th Annual Financials CEO Conference 2025 Transcript,Barclays PLC (BCS) Presents at Bank of America 30th Annual Financials CEO Conference 2025 Transcript
MUFG,2025-09-17 08:31:51,2025-09-17,Oil Stays in Narrow Range With Russian Supply Risks in Focus,Oil Stays in Narrow Range With Russian Supply Risks in Focus
MUFG,2025-09-17 10:50:29,2025-09-17,Canadian Dollar Lags G10 as Markets Fully Price BoC Rate Cut Wednesday,Canadian Dollar Lags G10 as Markets Fully Price BoC Rate Cut Wednesday
SCBFF,2025-09-17 10:53:49,2025-09-17,__COMPANY__ PLC (SCBFY) Presents at __COMPANY__ 30th Annual Financials CEO Conference 2025 Transcript,Standard Chartered PLC (SCBFY) Presents at Bank of America 30th Annual Financials CEO Conference 2025 Transcript
MUFG,2025-09-17 11:00:00,2025-09-17,"__COMPANY__ Financial Group and Clearbrook, LLC Launch __TICKER__ ’s First ETF; Listed on the New York Stock Exchange","Mitsubishi UFJ Financial Group and Clearbrook, LLC Launch MUFG’s First ETF; Listed on the New York Stock Exchange"
DB,2025-09-17 12:22:28,2025-09-17,' __COMPANY__ 's asset manager kicks off sale of data centre business'- Financial Times,'Deutsche Bank's asset manager kicks off sale of data centre business'- Financial Times
DB,2025-09-17 13:04:14,2025-09-17,' __COMPANY__ Backs Proposed Global Defence Bank','Deutsche Bank Backs Proposed Global Defence Bank' - Reuters News
RY,2025-09-17 14:50:09,2025-09-17,"__COMPANY__ Royal Bank Decreases Prime Rate By 25 Basis Points From 4.95% To 4.70%, Effective September 18","RBC Royal Bank Decreases Prime Rate By 25 Basis Points From 4.95% To 4.70%, Effective September 18"
MFG,2025-09-17 15:40:02,2025-09-17,__TICKER__ vs. __TICKER__ : Which Stock Is the Better Value Option?,MFG vs. TD: Which Stock Is the Better Value Option?
TD,2025-09-17 15:40:02,2025-09-17,__TICKER__ vs. __TICKER__ : Which Stock Is the Better Value Option?,MFG vs. TD: Which Stock Is the Better Value Option?
TD,2025-09-17 18:18:31,2025-09-17,"Wall Street is Bullish on __COMPANY__ Bank __TICKER__ , Here’s Why?","Wall Street is Bullish on Toronto-Dominion Bank (TD), Here’s Why?"
MUFG,2025-09-17 19:09:00,2025-09-17,Oil Futures Snap Three-Session Winning Streak,Oil Futures Snap Three-Session Winning Streak
DB,2025-09-17 19:18:30,2025-09-17,Here’s Why Wall Street is Bullish on __COMPANY__ __TICKER__,Here’s Why Wall Street is Bullish on Deutsche Bank (DB)
DB,2025-09-17 22:18:00,2025-09-17,__COMPANY__ Decreases Prime Lending Rate to 7.25%,Deutsche Bank Decreases Prime Lending Rate to 7.25%
DB,2025-09-18 08:43:53,2025-09-18,__COMPANY__ Aktiengesellschaft __TICKER__ Presents at __COMPANY__ 30th Annual Financials CEO Conference 2025 Transcript,Deutsche Bank Aktiengesellschaft (DB) Presents at Bank of America 30th Annual Financials CEO Conference 2025 Transcript
MUFG,2025-09-18 09:32:47,2025-09-18,Gold Falls on Firmer U.S. Dollar After Fed Outlook,Gold Falls on Firmer U.S. Dollar After Fed Outlook
BACHY,2025-09-18 10:30:00,2025-09-18,"__TICKER__ , __COMPANY__ , BOCHK cut prime rates for first time since December","HSBC, Standard Chartered, BOCHK cut prime rates for first time since December"
MUFG,2025-09-18 11:14:30,2025-09-18,"Weak Activity, Labor Market Data Trigger New Zealand, Australia Dollar Underperformance, Says Mitsubishi UFG","Weak Activity, Labor Market Data Trigger New Zealand, Australia Dollar Underperformance, Says Mitsubishi UFG"
SAN,2025-09-18 11:35:52,2025-09-18,' __COMPANY__ Said to Buy €100 Million of __COMPANY__ 's Real Estate Loans','BofA Said to Buy €100 Million of Santander's Real Estate Loans' -Bloomberg
MUFG,2025-09-18 12:00:00,2025-09-18,kWh Analytics Closes Parametric Wind Proxy Hedge for Apex Clean Energy,kWh Analytics Closes Parametric Wind Proxy Hedge for Apex Clean Energy
MUFG,2025-09-18 14:00:00,2025-09-18,Fusion Fuel Cycles Inc. Secures CA$20M Loan from JBIC and __TICKER__ to Advance UNITY-2 Test Loop,Fusion Fuel Cycles Inc. Secures CA$20M Loan from JBIC and MUFG to Advance UNITY-2 Test Loop
BNPQY,2025-09-18 16:08:15,2025-09-18,AT&T Looking to Sell at Least $4 Billion in High-Grade Bonds,AT&T Looking to Sell at Least $4 Billion in High-Grade Bonds
SMFG,2025-09-18 16:37:47,2025-09-18,Top Midday Stories: Nvidia to Invest $5 Billion in Intel; FTC Sues Live Nation for Alleged Illegal Ticket Resale Tactics,Top Midday Stories: Nvidia to Invest $5 Billion in Intel; FTC Sues Live Nation for Alleged Illegal Ticket Resale Tactics
SMFG,2025-09-18 18:11:13,2025-09-18,Sector Update: Financial,Sector Update: Financial
SMFG,2025-09-18 18:47:00,2025-09-18,Sector Update: Financial Stocks Rise Thursday Afternoon,Sector Update: Financial Stocks Rise Thursday Afternoon
SMFG,2025-09-18 19:49:11,2025-09-18,Sector Update: Financial Stocks Rise Late Afternoon,Sector Update: Financial Stocks Rise Late Afternoon
BNPQY,2025-09-18 20:29:26,2025-09-18,US corporate bond dealmaking jumps day after Fed rate cut,US corporate bond dealmaking jumps day after Fed rate cut
SMFG,2025-09-19 04:37:57,2025-09-19,"Jefferies And __COMPANY__ Group Expand Global Strategic Alliance With $2.5B Credit Facilities, Joint Venture In Japan And Equity Ownership Increase","Jefferies And SMBC Group Expand Global Strategic Alliance With $2.5B Credit Facilities, Joint Venture In Japan And Equity Ownership Increase"
SMFG,2025-09-19 08:55:00,2025-09-19,Jefferies Deepens Ties With Japan’s __COMPANY__,Jefferies Deepens Ties With Japan’s Sumitomo Mitsui
SMFG,2025-09-19 09:00:00,2025-09-19,__COMPANY__ Group and Jefferies Significantly Expand Their Global Strategic Alliance,SMBC Group and Jefferies Significantly Expand Their Global Strategic Alliance
MUFG,2025-09-19 09:09:22,2025-09-19,Oil Poised for Modest Weekly Gain as Russian Supply Risks Remain in Focus,Oil Poised for Modest Weekly Gain as Russian Supply Risks Remain in Focus
DB,2025-09-19 10:19:31,2025-09-19,"Reported Earlier: ' __COMPANY__ working with __TICKER__ , Rothschild on possible Banco BPM deal, sources say'- Reuters","Reported Earlier: 'Credit Agricole working with DB, Rothschild on possible Banco BPM deal, sources say'- Reuters"
RY,2025-09-19 12:52:00,2025-09-19,"__COMPANY__ : Strong Industry, Solid Earnings Estimate Revision","Royal Bank of Canada: Strong Industry, Solid Earnings Estimate Revision"
RY,2025-09-19 14:00:02,2025-09-19,Why Investors Need to Take Advantage of These 2 Finance Stocks Now,Why Investors Need to Take Advantage of These 2 Finance Stocks Now
SMFG,2025-09-19 14:37:08,2025-09-19,Jefferies And __COMPANY__ Plot Bold Push Into Global Capital Markets,Jefferies And SMBC Plot Bold Push Into Global Capital Markets
MFG,2025-09-19 15:34:00,2025-09-19,Jefferies Gains on __TICKER__ 's Plan to Deepen Stake & Partnership,Jefferies Gains on SMFG's Plan to Deepen Stake & Partnership
SMFG,2025-09-19 15:34:00,2025-09-19,Jefferies Gains on __TICKER__ 's Plan to Deepen Stake & Partnership,Jefferies Gains on SMFG's Plan to Deepen Stake & Partnership
MUFG,2025-09-19 20:03:00,2025-09-19,Navan Files Registration Statement for Proposed Initial Public Offering,Navan Files Registration Statement for Proposed Initial Public Offering
BNPQY,2025-09-19 20:09:48,2025-09-19,See Positive Backdrop For Credit: __COMPANY__ ' Robson,See Positive Backdrop For Credit: BNP Paribas' Robson
SMFG,2025-09-19 20:14:49,2025-09-19,Wall Street Meets Tokyo: __TICKER__ Drops $912M to Supercharge Jefferies Deal,Wall Street Meets Tokyo: SMFG Drops $912M to Supercharge Jefferies Deal
SAN,2025-09-20 08:15:00,2025-09-20,Our Top 10 High Growth Dividend Stocks - September 2025,Our Top 10 High Growth Dividend Stocks - September 2025
BNPQY,2025-09-20 20:00:00,2025-09-20,Investors Turn to Derivatives for US Corporate Bonds As Issuers Can't Keep Up,Investors Turn to Derivatives for US Corporate Bonds As Issuers Can't Keep Up
BNPQY,2025-09-21 12:03:08,2025-09-21,How __COMPANY__ Shares Stack Up After 34% Rally and Recent Earnings Release,How BNP Paribas Shares Stack Up After 34% Rally and Recent Earnings Release
MUFG,2025-09-22 02:55:39,2025-09-22,Rupee slips as H-1B visa fee hit for Indian stocks drags sentiment,Rupee slips as H-1B visa fee hit for Indian stocks drags sentiment
BNPQY,2025-09-22 10:31:00,2025-09-22,CROWN PRE Stabilization Notice,CROWN PRE Stabilization Notice
MUFG,2025-09-22 10:47:53,2025-09-22,__TICKER__ Expects SNB to Hold Rates as Swiss Franc Strength Persists,MUFG Expects SNB to Hold Rates as Swiss Franc Strength Persists
BNPQY,2025-09-22 12:36:00,2025-09-22,__COMPANY__ Primary New Issues: No STAB Sammontana,BNP Paribas Primary New Issues: No STAB Sammontana
MUFG,2025-09-22 13:45:00,2025-09-22,How Enhanced Partnership With __COMPANY__ Group Will Drive JEF's Prospects,How Enhanced Partnership With SMBC Group Will Drive JEF's Prospects
SMFG,2025-09-22 13:45:00,2025-09-22,How Enhanced Partnership With __COMPANY__ Group Will Drive JEF's Prospects,How Enhanced Partnership With SMBC Group Will Drive JEF's Prospects
MUFG,2025-09-22 14:06:00,2025-09-22,Freddie Mac Appoints Matthew Abrusci General Counsel,Freddie Mac Appoints Matthew Abrusci General Counsel
MUFG,2025-09-22 16:29:26,2025-09-22,"No Yen Relief After Bank of Japan Policy Meeting as LDP Leadership Contest Formally Kicks Off, Says Mitsubishi UFG","No Yen Relief After Bank of Japan Policy Meeting as LDP Leadership Contest Formally Kicks Off, Says Mitsubishi UFG"
UBS,2025-09-22 18:16:00,2025-09-22,"Another __TICKER__ Advisor Team Jumps Ship, This Time to Launch an Independent Firm","Another UBS Advisor Team Jumps Ship, This Time to Launch an Independent Firm"
BNPQY,2025-09-22 20:05:00,2025-09-22,AerCap Holdings N.V. Announces Pricing of $1.2 Billion Aggregate Principal Amount of Senior Notes,AerCap Holdings N.V. Announces Pricing of $1.2 Billion Aggregate Principal Amount of Senior Notes
MUFG,2025-09-22 20:55:00,2025-09-22,Basic Materials Roundup: Market Talk,Basic Materials Roundup: Market Talk
TD,2025-09-22 21:31:00,2025-09-22,"__TICKER__ Bank Announces Redemption of Non-Cumulative 5-Year Rate Reset Class A First Preferred Shares, Series 9 (NVCC)","TD Bank Announces Redemption of Non-Cumulative 5-Year Rate Reset Class A First Preferred Shares, Series 9 (NVCC)"
UBS,2025-09-23 07:58:52,2025-09-23,' __TICKER__ Raises $824 Million From Risky Bond in Australia','UBS Raises $824 Million From Risky Bond in Australia' - Bloomberg News
DB,2025-09-23 08:20:03,2025-09-23,__COMPANY__ Launches Private Markets Fund For Private Clients In Collaboration With DWS And Partners Group,Deutsche Bank Launches Private Markets Fund For Private Clients In Collaboration With DWS And Partners Group
UBS,2025-09-23 08:20:55,2025-09-23,"__TICKER__ Resolves Legacy French Tax Matter, Pays €835 Million","UBS Resolves Legacy French Tax Matter, Pays €835 Million"
MUFG,2025-09-23 08:35:18,2025-09-23,Oil Falls on Rising Supply Outlook,Oil Falls on Rising Supply Outlook
BNPQY,2025-09-23 08:54:00,2025-09-23,Stabilization Notice: Pre Stab Notice - INEOS FINANCE PLC,Stabilization Notice: Pre Stab Notice - INEOS FINANCE PLC
MUFG,2025-09-23 09:13:00,2025-09-23,New Strong Buy Stocks for September 23rd,New Strong Buy Stocks for September 23rd
BNPQY,2025-09-23 10:30:56,2025-09-23,Fnality Raises $136M to Expand Blockchain Payment Systems for Banks,Fnality Raises $136M to Expand Blockchain Payment Systems for Banks
UBS,2025-09-23 10:40:00,2025-09-23,__TICKER__ to Pay Nearly $1 Billion to Settle French Tax Case,UBS to Pay Nearly $1 Billion to Settle French Tax Case
MUFG,2025-09-23 11:14:24,2025-09-23,__COMPANY__ Financial Group ( __TICKER__ ): Evaluating Valuation as Bank of Japan Signals Potential Policy Shift,Mitsubishi UFJ Financial Group (TSE:8306): Evaluating Valuation as Bank of Japan Signals Potential Policy Shift
