stock,date,date_only,headline,headline_raw
MUFG,2026-01-06 05:48:53,2026-01-06,Credit Markets Rev Up After $61 Billion of Deals in One Day,Credit Markets Rev Up After $61 Billion of Deals in One Day
ACGBY,2026-01-06 05:48:53,2026-01-06,Credit Markets Rev Up After $61 Billion of Deals in One Day,Credit Markets Rev Up After $61 Billion of Deals in One Day
MUFG,2026-01-06 09:56:42,2026-01-06,Gold Rises With Focus on Upcoming U.S. Data,Gold Rises With Focus on Upcoming U.S. Data
RY,2026-01-06 10:15:09,2026-01-06,__COMPANY__ CEO Dave Mckay Says The Acceleration Of The Growth And Remediation Of Our U.S. Platform Is Expected To Increase Our Return On Equity; Leveraging Credit Risk Is Still One Of The Key Risks That We Have To Manage; I See Enormous Opportunity For Return On Investments In The United States,Royal Bank Of Canada CEO Dave Mckay Says The Acceleration Of The Growth And Remediation Of Our U.S. Platform Is Expected To Increase Our Return On Equity; Leveraging Credit Risk Is Still One Of The Key Risks That We Have To Manage; I See Enormous Opportunity For Return On Investments In The United States
UBS,2026-01-06 11:15:32,2026-01-06,"__TICKER__ Is Still Worth Holding, As 2026 Investment Banking Deals Could Drive Upside","UBS Is Still Worth Holding, As 2026 Investment Banking Deals Could Drive Upside"
TD,2026-01-06 12:31:57,2026-01-06,TSX Dividend Stocks Transcontinental And 2 Others For Reliable Income,TSX Dividend Stocks Transcontinental And 2 Others For Reliable Income
MUFG,2026-01-06 14:54:00,2026-01-06,Global M&A Engine Revs Up: How to Play __COMPANY__ Stock?,Global M&A Engine Revs Up: How to Play Morgan Stanley Stock?
RY,2026-01-06 15:01:00,2026-01-06,__COMPANY__ welcomes professional golfer Shane Lowry as newest Team __COMPANY__ ambassador,RBC welcomes professional golfer Shane Lowry as newest Team RBC ambassador
STT,2026-01-06 17:27:00,2026-01-06,Investors Pour Record Amount of Money Into ETFs. Here’s Where They Invested.,Investors Pour Record Amount of Money Into ETFs. Here’s Where They Invested.
HSBC,2026-01-06 18:31:09,2026-01-06,__COMPANY__ : My Top Pick In The Financial Sector Before Q4 Earnings,JPMorgan: My Top Pick In The Financial Sector Before Q4 Earnings
BCS,2026-01-06 18:47:08,2026-01-06,Hits And Misses: My (Slightly Outsized) Performance In 2025 And A Look Forward,Hits And Misses: My (Slightly Outsized) Performance In 2025 And A Look Forward
BCS,2026-01-07 04:01:57,2026-01-07,__COMPANY__ Enters Stablecoin Market With First-Of-Its-Kind Investment In This US Startup (UPDATED),Barclays Enters Stablecoin Market With First-Of-Its-Kind Investment In This US Startup (UPDATED)
BCS,2026-01-07 08:48:47,2026-01-07,__COMPANY__ Invests In U.S.-Based Clearing System For Digital Money Ubyx; Terms Not Disclosed,Barclays Invests In U.S.-Based Clearing System For Digital Money Ubyx; Terms Not Disclosed
STT,2026-01-07 09:20:09,2026-01-07,"Truist Securities Downgrades __COMPANY__ to Hold, Raises Price Target to $138","Truist Securities Downgrades State Street to Hold, Raises Price Target to $138"
BCS,2026-01-07 09:55:34,2026-01-07,10 Predictions For 2026,10 Predictions For 2026
DB,2026-01-07 09:55:34,2026-01-07,10 Predictions For 2026,10 Predictions For 2026
SCBFF,2026-01-07 10:30:00,2026-01-07,__COMPANY__ : Not Cheap But Still Attractive After Its Run,Standard Chartered: Not Cheap But Still Attractive After Its Run
TD,2026-01-07 11:07:59,2026-01-07,The __COMPANY__ Bank ( __TICKER__ :CA) Presents at __COMPANY__ Capital Markets Canadian Bank CEO Conference Transcript,The Toronto-Dominion Bank (TD:CA) Presents at RBC Capital Markets Canadian Bank CEO Conference Transcript
TD,2026-01-07 12:31:59,2026-01-07,Top TSX Dividend Stocks To Watch In January 2026,Top TSX Dividend Stocks To Watch In January 2026
SAN,2026-01-07 12:48:28,2026-01-07,Banco __COMPANY__ : Major Re-Rating Diminishes The Value Case (Downgrade),Banco Santander: Major Re-Rating Diminishes The Value Case (Downgrade)
UBS,2026-01-07 12:49:39,2026-01-07,' __TICKER__ Capital Compromise Plan Gets Backing of Largest Swiss Party','UBS Capital Compromise Plan Gets Backing of Largest Swiss Party' - Bloomberg
BNPQY,2026-01-07 12:52:18,2026-01-07,"__COMPANY__ Launches __TICKER__ Coin On Canton Network Backed By __COMPANY__ , __COMPANY__","JPMorgan Launches JPM Coin On Canton Network Backed By Goldman Sachs, BNP Paribas"
MUFG,2026-01-07 13:00:00,2026-01-07,Adapture Renewables Closes $233 Million in Financing from U.S. Bank for Titanium Solar Projects in Illinois and Arkansas,Adapture Renewables Closes $233 Million in Financing from U.S. Bank for Titanium Solar Projects in Illinois and Arkansas
STT,2026-01-07 13:17:11,2026-01-07,"__TICKER__ Cowen Maintains Buy on __COMPANY__ , Raises Price Target to $155","TD Cowen Maintains Buy on State Street, Raises Price Target to $155"
MUFG,2026-01-07 15:00:00,2026-01-07,MUFJ Bank Adopts Private AI,MUFJ Bank Adopts Private AI
STT,2026-01-07 16:01:59,2026-01-07,Truist Securities Downgrades __COMPANY__ __TICKER__,Truist Securities Downgrades State Street (STT)
SAN,2026-01-07 17:00:52,2026-01-07,"If You Invested $1000 In Banco __COMPANY__ Stock 5 Years Ago, You Would Have This Much Today","If You Invested $1000 In Banco Santander Stock 5 Years Ago, You Would Have This Much Today"
STT,2026-01-07 17:28:00,2026-01-07,Northern Trust Broadens UHNW Direct Indexing Access via Envestnet,Northern Trust Broadens UHNW Direct Indexing Access via Envestnet
TD,2026-01-08 00:00:00,2026-01-08,__TICKER__ Bank Group Announces Intention to Purchase for Cancellation up to 61 Million of its Common Shares,TD Bank Group Announces Intention to Purchase for Cancellation up to 61 Million of its Common Shares
TD,2026-01-08 01:00:32,2026-01-08,MT Newswires Canada Stocks To Watch: __TICKER__ Bank; Boyd Group Services,MT Newswires Canada Stocks To Watch: TD Bank; Boyd Group Services
MUFG,2026-01-08 02:09:36,2026-01-08,Why __COMPANY__ ( __TICKER__ ) Is Up 5.1% After AI Upskilling Push And Capital Moves,Why Mitsubishi UFJ (TSE:8306) Is Up 5.1% After AI Upskilling Push And Capital Moves
TD,2026-01-08 03:31:04,2026-01-08,"Reported Earlier, __TICKER__ Bank Group Plans New Normal Course Issuer Bid To Repurchase And Cancel Up To 61M Common Shares Worth $7B Following $8B Prior Buyback","Reported Earlier, TD Bank Group Plans New Normal Course Issuer Bid To Repurchase And Cancel Up To 61M Common Shares Worth $7B Following $8B Prior Buyback"
HSBC,2026-01-08 09:59:54,2026-01-08,' __TICKER__ Agrees to Pay €300 Million to End French Tax Dividend Probes','HSBC Agrees to Pay €300 Million to End French Tax Dividend Probes' - Bloomberg
TD,2026-01-08 12:27:16,2026-01-08,Telus Engages Advisors to Support Telus Health Business,Telus Engages Advisors to Support Telus Health Business
TD,2026-01-08 12:32:13,2026-01-08,3 Canadian Dividend Stocks On The TSX Yielding Up To 13.8%,3 Canadian Dividend Stocks On The TSX Yielding Up To 13.8%
RY,2026-01-08 13:24:50,2026-01-08,__COMPANY__ ( __TICKER__ :CA) Presents at __COMPANY__ Capital Markets Canadian Bank CEO Conference Transcript,Royal Bank of Canada (RY:CA) Presents at RBC Capital Markets Canadian Bank CEO Conference Transcript
MUFG,2026-01-08 13:48:54,2026-01-08,Canada's International Merchandise Trade Deficit Lower Than Expected in October,Canada's International Merchandise Trade Deficit Lower Than Expected in October
ING,2026-01-08 15:00:52,2026-01-08,Peering Into __TICKER__ Groep NV's Recent Short Interest,Peering Into ING Groep NV's Recent Short Interest
STT,2026-01-08 15:30:00,2026-01-08,__COMPANY__ Supports Columbia Threadneedle UCITS ETF Launch,State Street Supports Columbia Threadneedle UCITS ETF Launch
RY,2026-01-08 18:53:33,2026-01-08,"Market Chatter: __COMPANY__ , __COMPANY__ Line Up $1.8 Billion Debt for TreeHouse Deal","Market Chatter: Royal Bank of Canada, Deutsche Bank Line Up $1.8 Billion Debt for TreeHouse Deal"
RY,2026-01-08 20:35:00,2026-01-08,Eurasia Group and __COMPANY__ Team Up to Reset the Conversation on the US-Canada Relationship,Eurasia Group and Royal Bank of Canada Team Up to Reset the Conversation on the US-Canada Relationship
RY,2026-01-08 20:57:55,2026-01-08,Sector Update: Financial Stocks Advance Late Afternoon,Sector Update: Financial Stocks Advance Late Afternoon
DB,2026-01-08 20:57:55,2026-01-08,Sector Update: Financial Stocks Advance Late Afternoon,Sector Update: Financial Stocks Advance Late Afternoon
STT,2026-01-09 03:38:35,2026-01-09,Custody Bank Stocks Q3 Results: Benchmarking __COMPANY__ ( __TICKER__ ),Custody Bank Stocks Q3 Results: Benchmarking State Street (NYSE:STT)
DB,2026-01-09 04:31:19,2026-01-09,Looking At The Narrative For United Natural Foods UNFI After Valuation Assumptions Hold Steady,Looking At The Narrative For United Natural Foods UNFI After Valuation Assumptions Hold Steady
SAN,2026-01-09 08:48:55,2026-01-09,Banco __COMPANY__ Sells 49% Stake In Polish Subsidiary To Erste Group,Banco Santander Sells 49% Stake In Polish Subsidiary To Erste Group
MUFG,2026-01-09 09:25:53,2026-01-09,Gold Rises Ahead of Key U.S. Economic Data,Gold Rises Ahead of Key U.S. Economic Data
SAN,2026-01-09 13:01:48,2026-01-09,Best savings account deals for 2026,Best savings account deals for 2026
MUFG,2026-01-09 13:30:57,2026-01-09,__COMPANY__ Financial: Eyes On Latest Investment And New Leader,Mitsubishi UFJ Financial: Eyes On Latest Investment And New Leader
STT,2026-01-09 15:00:05,2026-01-09,__COMPANY__ Corporation __TICKER__ Earnings Expected to Grow: Should You Buy?,State Street Corporation (STT) Earnings Expected to Grow: Should You Buy?
TD,2026-01-09 15:57:50,2026-01-09,__COMPANY__ : Time To Pause After The Huge Returns (Downgrade),Toronto-Dominion: Time To Pause After The Huge Returns (Downgrade)
DB,2026-01-09 17:05:00,2026-01-09,"Stocks Sail Past Jobs Data, Tariff Opinion Delay. Earnings Season Looms.","Stocks Sail Past Jobs Data, Tariff Opinion Delay. Earnings Season Looms."
SCGLY,2026-01-09 17:05:00,2026-01-09,__COMPANY__ : shares and voting rights as of 31 December 2025,Societe Generale: shares and voting rights as of 31 December 2025
DB,2026-01-09 17:23:17,2026-01-09,"__COMPANY__ 's Comeback: Low Valuation, Rising Profits, Strong Capital Position","Deutsche Bank's Comeback: Low Valuation, Rising Profits, Strong Capital Position"
RY,2026-01-09 18:11:54,2026-01-09,Assessing __COMPANY__ ( __TICKER__ ) Valuation After Strong Recent Shareholder Returns,Assessing Royal Bank of Canada (TSX:RY) Valuation After Strong Recent Shareholder Returns
DB,2026-01-09 18:16:21,2026-01-09,How Recent Developments Are Reframing The Hilton Food Group ( __TICKER__ ) Investment Story,How Recent Developments Are Reframing The Hilton Food Group (LSE:HFG) Investment Story
DB,2026-01-09 20:25:00,2026-01-09,Top Stocks to Double Up on Right Now,Top Stocks to Double Up on Right Now
RY,2026-01-09 21:35:00,2026-01-09,__COMPANY__ Global Asset Management Inc. seeks new sub-advisor for __COMPANY__ Private U.S. Growth Equity Pool,RBC Global Asset Management Inc. seeks new sub-advisor for RBC Private U.S. Growth Equity Pool
STT,2026-01-10 12:00:12,2026-01-10,"Insiders At __COMPANY__ Sold US$8.4m In Stock, Alluding To Potential Weakness","Insiders At State Street Sold US$8.4m In Stock, Alluding To Potential Weakness"
DB,2026-01-11 15:17:00,2026-01-11,Why Smart Money Is Looking Overseas for Bank Stocks,Why Smart Money Is Looking Overseas for Bank Stocks
DB,2026-01-11 23:11:34,2026-01-11,Why The Narrative Around National Bank Of Greece (ATSE:ETE) Is Shifting With New Targets And Governance,Why The Narrative Around National Bank Of Greece (ATSE:ETE) Is Shifting With New Targets And Governance
IDCBY,2026-01-12 01:00:00,2026-01-12,CDB Aviation Signs New Sustainability Linked Unsecured Term Loan for $710 Million,CDB Aviation Signs New Sustainability Linked Unsecured Term Loan for $710 Million
BK,2026-01-12 03:01:52,2026-01-12,Earnings To Watch: __COMPANY__ __TICKER__ Reports Q4 Results Tomorrow,Earnings To Watch: BNY (BK) Reports Q4 Results Tomorrow
HSBC,2026-01-12 09:58:29,2026-01-12,__TICKER__ Rolls Out New UAE Asset Management Business,HSBC Rolls Out New UAE Asset Management Business
BK,2026-01-12 10:00:18,2026-01-12,A Look Ahead: __COMPANY__ 's Earnings Forecast,A Look Ahead: Bank of New York Mellon's Earnings Forecast
BCS,2026-01-12 10:31:05,2026-01-12,Shares of banking and financial stocks are trading lower after President Trump said failure to cap rates at 10% by Jan. 20 will be treated as a violation of the law.,Shares of banking and financial stocks are trading lower after President Trump said failure to cap rates at 10% by Jan. 20 will be treated as a violation of the law.
MUFG,2026-01-12 12:11:56,2026-01-12,Mitsubishi UFG Says Snap Election Speculation in Japan Triggers Renewed Yen Weakness,Mitsubishi UFG Says Snap Election Speculation in Japan Triggers Renewed Yen Weakness
BK,2026-01-12 12:47:15,2026-01-12,Stocks Fall Pre-Bell as Fed Chair Powell Faces Department of Justice Probe,Stocks Fall Pre-Bell as Fed Chair Powell Faces Department of Justice Probe
RY,2026-01-12 12:50:35,2026-01-12,__COMPANY__ ( __TICKER__ ) Will Pay A Larger Dividend Than Last Year At CA$1.64,Royal Bank of Canada (TSE:RY) Will Pay A Larger Dividend Than Last Year At CA$1.64
DB,2026-01-12 13:06:00,2026-01-12,Aspen Power Secures $200 Million Strategic Capital Commitment from __COMPANY__,Aspen Power Secures $200 Million Strategic Capital Commitment from Deutsche Bank
BK,2026-01-12 13:43:22,2026-01-12,"Gold, Silver Spike To Record Highs As Fed Independence Falters: What's Moving Markets Monday?","Gold, Silver Spike To Record Highs As Fed Independence Falters: What's Moving Markets Monday?"
BK,2026-01-12 16:28:00,2026-01-12,"Banks Enter Earnings Season on Firmer Footing, Though Risks Linger","Banks Enter Earnings Season on Firmer Footing, Though Risks Linger"
DB,2026-01-12 17:03:12,2026-01-12,__COMPANY__ Draws Binding Bids for India Retail Assets,Deutsche Bank Draws Binding Bids for India Retail Assets
RY,2026-01-12 17:50:00,2026-01-12,Nu Holdings Gains 34% in 6 Months: Should Investors Buy the Stock?,Nu Holdings Gains 34% in 6 Months: Should Investors Buy the Stock?
SAN,2026-01-12 18:08:00,2026-01-12,VINCI: ASF successfully issued an 8-year €500 million bond,VINCI: ASF successfully issued an 8-year €500 million bond
BK,2026-01-12 18:08:00,2026-01-12,PNC Financial's Q4 Earnings on the Deck: Here's What to Expect,PNC Financial's Q4 Earnings on the Deck: Here's What to Expect
STT,2026-01-12 18:12:00,2026-01-12,"Rise in Fee Income, NII Likely to Aid __COMPANY__ Mellon's Q4 Earnings","Rise in Fee Income, NII Likely to Aid BNY Mellon's Q4 Earnings"
BK,2026-01-12 18:12:00,2026-01-12,"Rise in Fee Income, NII Likely to Aid __COMPANY__ Mellon's Q4 Earnings","Rise in Fee Income, NII Likely to Aid BNY Mellon's Q4 Earnings"
STT,2026-01-12 18:14:00,2026-01-12,"Inflows, AUM Growth Likely to Support BlackRock's Q4 Earnings","Inflows, AUM Growth Likely to Support BlackRock's Q4 Earnings"
STT,2026-01-12 18:26:42,2026-01-12,5 Gold ETFs With Glittering Prospects in 2026,5 Gold ETFs With Glittering Prospects in 2026
BK,2026-01-12 18:30:00,2026-01-12,Bank earnings: What to expect in 2026 amid capital market changes,Bank earnings: What to expect in 2026 amid capital market changes
BK,2026-01-12 18:40:00,2026-01-12,Traders Are Moving Past Powell's Investigation: U.S. Stock Index Outlook And Pre-CPI Trading Levels,Traders Are Moving Past Powell's Investigation: U.S. Stock Index Outlook And Pre-CPI Trading Levels
BK,2026-01-12 18:56:50,2026-01-12,Tuesday's big stock stories: What’s likely to move the market in the next trading session,Tuesday's big stock stories: What’s likely to move the market in the next trading session
BK,2026-01-12 19:27:38,2026-01-12,Equities Rise Intraday Amid Probe Into Fed Chair Powell,Equities Rise Intraday Amid Probe Into Fed Chair Powell
STT,2026-01-12 20:20:01,2026-01-12,"Top Stocks With Earnings This Week: TSMC, Big Banks And More","Top Stocks With Earnings This Week: TSMC, Big Banks And More"
BK,2026-01-12 20:20:01,2026-01-12,"Top Stocks With Earnings This Week: TSMC, Big Banks And More","Top Stocks With Earnings This Week: TSMC, Big Banks And More"
DB,2026-01-12 20:36:26,2026-01-12,__COMPANY__ : From Rerating To Proof-Of-Execution,Deutsche Bank: From Rerating To Proof-Of-Execution
BK,2026-01-12 21:41:52,2026-01-12,"S&P 500, Dow Clinch New Peaks as Traders Shrug Off Fed Independence Concerns","S&P 500, Dow Clinch New Peaks as Traders Shrug Off Fed Independence Concerns"
BK,2026-01-13 00:00:30,2026-01-13,"__COMPANY__ earnings, December CPI, Trump comments: What to Watch","JPMorgan earnings, December CPI, Trump comments: What to Watch"
MUFG,2026-01-13 00:15:00,2026-01-13,Energy Transfer LP Announces Pricing of $3.0 Billion of Senior Notes,Energy Transfer LP Announces Pricing of $3.0 Billion of Senior Notes
UBS,2026-01-13 03:33:48,2026-01-13,' __TICKER__ Boss Sergio Ermotti Plans To Step Down In April 2027' - FT,'UBS Boss Sergio Ermotti Plans To Step Down In April 2027' - FT
BK,2026-01-13 05:11:34,2026-01-13,__COMPANY__ kicks off new earnings season,JPMorgan kicks off new earnings season
BK,2026-01-13 06:06:24,2026-01-13,"__COMPANY__ , Delta Air Lines And 3 Stocks To Watch Heading Into Tuesday","JPMorgan, Delta Air Lines And 3 Stocks To Watch Heading Into Tuesday"
BK,2026-01-13 06:07:06,2026-01-13,"Dow, S&P 500 Hit New Highs: Investor Sentiment Improves, Fear & Greed Index Moves To 'Greed' Zone","Dow, S&P 500 Hit New Highs: Investor Sentiment Improves, Fear & Greed Index Moves To 'Greed' Zone"
BK,2026-01-13 06:35:00,2026-01-13,__COMPANY__ 4Q Profit Rises On Net Interest Income Growth,BNY 4Q Profit Rises On Net Interest Income Growth
BK,2026-01-13 06:35:01,2026-01-13,__COMPANY__ raises profit target as CEO Robin Vince says 'turnaround' is taking hold,BNY raises profit target as CEO Robin Vince says 'turnaround' is taking hold
BK,2026-01-13 07:11:07,2026-01-13,"Earnings Scheduled For January 13, 2026","Earnings Scheduled For January 13, 2026"
BK,2026-01-13 07:22:00,2026-01-13,"Rise in Fee Income, NII Likely to Aid __TICKER__ 's Q4 Earnings (Revised)","Rise in Fee Income, NII Likely to Aid BK's Q4 Earnings (Revised)"
STT,2026-01-13 07:22:00,2026-01-13,"Rise in Fee Income, NII Likely to Aid __TICKER__ 's Q4 Earnings (Revised)","Rise in Fee Income, NII Likely to Aid BK's Q4 Earnings (Revised)"
BK,2026-01-13 07:33:24,2026-01-13,"Stocks making the biggest moves premarket: L3Harris, __COMPANY__ , Delta, Intel, AMD and more","Stocks making the biggest moves premarket: L3Harris, JPMorgan, Delta, Intel, AMD and more"
BK,2026-01-13 07:34:35,2026-01-13,"__COMPANY__ Q4 Adj. EPS $2.08 Beats $1.98 Estimate, Sales $5.179B Beat $5.136B Estimate","Bank of New York Mellon Q4 Adj. EPS $2.08 Beats $1.98 Estimate, Sales $5.179B Beat $5.136B Estimate"
BK,2026-01-13 08:06:50,2026-01-13,__COMPANY__ Sees FY2026 Sales $19.027B-$21.029B vs $20.023B Est,Bank of New York Mellon Sees FY2026 Sales $19.027B-$21.029B vs $20.023B Est
RY,2026-01-13 08:12:58,2026-01-13,"__COMPANY__ And Canadian Tire Launch Strategic Loyalty Partnership, Expanding Reach Of Triangle Rewards And Growing Network Of Strategic Merchant Partners","Royal Bank Of Canada And Canadian Tire Launch Strategic Loyalty Partnership, Expanding Reach Of Triangle Rewards And Growing Network Of Strategic Merchant Partners"
BK,2026-01-13 08:14:00,2026-01-13,__COMPANY__ CEO Says Pressure on Fed Is 'Counterproductive',Bank of New York Mellon CEO Says Pressure on Fed Is 'Counterproductive'
BK,2026-01-13 08:38:00,2026-01-13,"__COMPANY__ 4Q Profit Rises, CEO Calls Pressure on Fed 'Counterproductive' -- Update","BNY 4Q Profit Rises, CEO Calls Pressure on Fed 'Counterproductive' -- Update"
MUFG,2026-01-13 09:14:35,2026-01-13,Oil Gains on Iran Supply Disruption Fears After U.S. Tariffs,Oil Gains on Iran Supply Disruption Fears After U.S. Tariffs
UBS,2026-01-13 09:23:31,2026-01-13,'Ermotti Flags Job Cuts as __TICKER__ Nears Credit Suisse Integration','Ermotti Flags Job Cuts as UBS Nears Credit Suisse Integration' - Bloomberg
BK,2026-01-13 09:50:20,2026-01-13,"__COMPANY__ Clocks Record Profits In 2025, Assets Under Custody Near $60 Trillion","BNY Clocks Record Profits In 2025, Assets Under Custody Near $60 Trillion"
BK,2026-01-13 10:52:09,2026-01-13,"__COMPANY__ : Solid Q4, But Margin Expansion Set To Slow","Bank Of New York Mellon: Solid Q4, But Margin Expansion Set To Slow"
BK,2026-01-13 10:59:59,2026-01-13,"__COMPANY__ , __COMPANY__ muted despite Q4 beat","JPMorgan, Bank of New York Mellon muted despite Q4 beat"
MUFG,2026-01-13 11:18:43,2026-01-13,__TICKER__ Says Yen Continues to Weaken in Anticipation of Snap Election in Japan,MUFG Says Yen Continues to Weaken in Anticipation of Snap Election in Japan
BK,2026-01-13 11:30:04,2026-01-13,"Bank sector is hitting this 'trifecta,' set to outperform S&P 500","Bank sector is hitting this 'trifecta,' set to outperform S&P 500"
BK,2026-01-13 11:31:00,2026-01-13,The __COMPANY__ Corporation 2025 Q4 - Results - Earnings Call Presentation,The Bank of New York Mellon Corporation 2025 Q4 - Results - Earnings Call Presentation
BK,2026-01-13 11:37:00,2026-01-13,__COMPANY__ Reports Fourth Quarter 2025 Results,BNY Reports Fourth Quarter 2025 Results
BK,2026-01-13 11:39:00,2026-01-13,__COMPANY__ Declares Dividends,BNY Declares Dividends
BK,2026-01-13 11:48:00,2026-01-13,__COMPANY__ Profit Rises On Net Interest Income Growth,BNY Profit Rises On Net Interest Income Growth
RY,2026-01-13 12:01:00,2026-01-13,"__COMPANY__ and Canadian Tire Corporation launch loyalty partnership, unlocking more rewards and value for millions of Canadians","RBC and Canadian Tire Corporation launch loyalty partnership, unlocking more rewards and value for millions of Canadians"
BK,2026-01-13 12:08:40,2026-01-13,__COMPANY__ ( __TICKER__ ) Posts Better-Than-Expected Sales In Q4 CY2025,BNY (NYSE:BK) Posts Better-Than-Expected Sales In Q4 CY2025
DB,2026-01-13 12:20:24,2026-01-13,"Kotak, Federal Bank lead bids for __COMPANY__ ’s India retail portfolio – report","Kotak, Federal Bank lead bids for Deutsche Bank’s India retail portfolio – report"
BK,2026-01-13 12:30:00,2026-01-13,__COMPANY__ Mellon Earnings Top Expectations. Why the Stock Is Falling.,BNY Mellon Earnings Top Expectations. Why the Stock Is Falling.
BK,2026-01-13 12:37:08,2026-01-13,"Stocks making the biggest moves midday: __COMPANY__ , Moderna, Boeing, Cardinal Health, Chipotle & more","Stocks making the biggest moves midday: JPMorgan, Moderna, Boeing, Cardinal Health, Chipotle & more"
BK,2026-01-13 12:37:35,2026-01-13,Stocks Decline Pre-Bell Ahead of Key Inflation Report,Stocks Decline Pre-Bell Ahead of Key Inflation Report
BK,2026-01-13 12:42:00,2026-01-13,"These Stocks Are Today’s Movers: __COMPANY__ , Delta, L3Harris, Intel, AMD, __COMPANY__ Mellon, and More","These Stocks Are Today’s Movers: JPMorgan, Delta, L3Harris, Intel, AMD, BNY Mellon, and More"
DB,2026-01-13 13:00:00,2026-01-13,Proxymity Partners with __COMPANY__ to Enable Proxy Voting at US General Meetings,Proxymity Partners with Deutsche Bank to Enable Proxy Voting at US General Meetings
BK,2026-01-13 13:06:08,2026-01-13,Stock Market Today: Dow Falls Ahead Of Inflation Report; Delta Dives On Earnings (Live Coverage),Stock Market Today: Dow Falls Ahead Of Inflation Report; Delta Dives On Earnings (Live Coverage)
BNPQY,2026-01-13 13:15:08,2026-01-13,ageas: Recent Capital Deploy Support Income And Value Appeal,ageas: Recent Capital Deploy Support Income And Value Appeal
BK,2026-01-13 13:43:48,2026-01-13,Stock Market Today: Dow Reverses On Surprise Inflation Report; Delta Dives On Earnings News (Live Coverage),Stock Market Today: Dow Reverses On Surprise Inflation Report; Delta Dives On Earnings News (Live Coverage)
BK,2026-01-13 13:52:00,2026-01-13,"__COMPANY__ Profit Rises, CEO Calls Pressure on Fed ‘Counterproductive’","BNY Profit Rises, CEO Calls Pressure on Fed ‘Counterproductive’"
BK,2026-01-13 13:53:00,2026-01-13,__COMPANY__ Earnings Top Expectations. Why the Stock Is Falling.,Bank of New York Mellon Earnings Top Expectations. Why the Stock Is Falling.
MUFG,2026-01-13 14:00:00,2026-01-13,Summit Ridge Energy Secures $290 Million Facility with __TICKER__ to Expand Commercial Solar Portfolio,Summit Ridge Energy Secures $290 Million Facility with MUFG to Expand Commercial Solar Portfolio
BK,2026-01-13 14:09:49,2026-01-13,Fed expected to 'stick to the mandate' amid DOJ investigation,Fed expected to 'stick to the mandate' amid DOJ investigation
SAN,2026-01-13 14:13:00,2026-01-13,contourglobal pre Stabilization Notice,contourglobal pre Stabilization Notice
BK,2026-01-13 14:30:02,2026-01-13,The __COMPANY__ __TICKER__ Reports Q4 Earnings: What Key Metrics Have to Say,The Bank of New York Mellon (BK) Reports Q4 Earnings: What Key Metrics Have to Say
SAN,2026-01-13 14:58:37,2026-01-13,Vulture fund puts London broadband provider into administration,Vulture fund puts London broadband provider into administration
STT,2026-01-13 15:00:03,2026-01-13,Fifth Third Bancorp (FITB) Earnings Expected to Grow: What to Know Ahead of Next Week's Release,Fifth Third Bancorp (FITB) Earnings Expected to Grow: What to Know Ahead of Next Week's Release
RY,2026-01-13 15:45:00,2026-01-13,"__COMPANY__ Climate Action Institute 2026 Report: Climate Action Barometer falls--but tech, innovation and capital build new momentum","RBC Climate Action Institute 2026 Report: Climate Action Barometer falls--but tech, innovation and capital build new momentum"
BK,2026-01-13 15:50:00,2026-01-13,__COMPANY__ Stock Rises After Earnings Beat. What Wall Street Is Saying.,Bank of New York Mellon Stock Rises After Earnings Beat. What Wall Street Is Saying.
DB,2026-01-13 15:59:15,2026-01-13,__COMPANY__ Previews This Week's U.K. GDP Data,Deutsche Bank Previews This Week's U.K. GDP Data
STT,2026-01-13 16:05:00,2026-01-13,"Loan Growth, Rise in Fee Income to Aid __COMPANY__ 's Q4 Earnings","Loan Growth, Rise in Fee Income to Aid State Street's Q4 Earnings"
